text,label
"REF. DW REF. G 2.8 2 1 3 F E D O B A 2.5 1.5 C.1 2.2 A.6 E.9 F.7 A.0 EXISTING PUMP ROOM 316 ENVIRONMENTAL DIRECTOR'S OFFICE 317 PASSAGE 309A OFFICE #2 318 OFFICE 3 319 OFFICE #4 320 OFFICE #5 321 COOLER STORAGE 322 ENVIRONMENTAL 309 LAB 324 OFFICE #6 307 LAB STOR 324A OFFICE #7 305 SERVER 303 T.R. 326C T.R. 327C MEN'S LR 327 MUD ROOM 323 SHARED TEACHING KITCHEN 328 UNLOAD AREA 329 MAINTENANCE OFFICE 331 MAINTENANCE STORAGE 330 MECHANICAL ROOM 332 CLASSROOM 333 MEN TR-3 WOMEN TR-4 MECHANICAL ROOM 334 PRINTER 302 WAITING/LOBBY 301 PASSAGE 301A INTERVIEW 304 OFFICE #8 306 OFFICE #9 308 OFFICE #10 313 OFFICE #11 314 EQUIPMENT FIELD GEAR STORAGE 315 FILE STORAGE 312 BREAK ROOM 311 SHARED CONFERENCE 310 ENTRY/CORRIDOR 2 300 STAIR ST-4 STAIR 2 ST-2 TWO STORY COMMON AREA 900 1 1 1 2 2 2 2 2 2 3 3 3 2 4 5 6 6 6 / 1 FP-102 / 1 FP-101 / 1 FP-104 7 2 JANITOR CLOSET 325A STORAGE 325B LOCKER ROOM HALLWAY 325 LOCKER ROOM HALLWAY 325 LOCKERS 326B LOCKERS 327B 8 8 9 9 PLAN  NORTH B A C D KEY PLAN Beardsley Design Associates Architecture, Engineering, Landscape Architecture, D.P.C. © Filename: NOT FOR CONSTRUCTION no. revision description by date Project Number: Drawn By: Designed By: Reviewed By: WARNING Any alterations to this document not  conforming to section 7307. New York State  Education Law are strictly prohibited. 320 West Main Street  Malone, NY 12953 518.483.1585 5789 Widewaters Pkwy Dewitt, NY 13214 315.472.6980 64 South Street Auburn, NY 13021 315.253.7301 AUBURN MALONE SYRACUSE 2/11/2022 3:35:30 PM C:\Users\jcappotelli\Documents\17159 - IGA SRMT MEP Central_jcappotelli.rvt Saint Regis Mohawk Tribe FP-103 2/11/2022 PARTIAL FIRST FLOOR PLAN - AREA C RENOVATIONS OF THE IGA BUILDING 850 NY-37, Hogansburg, NY 13655 CONSTRUCTION DOCUMENTS WAB 18029 NMG NMG DRAWING NOTES: 1 1/8"" = 1'-0"" 1 PARTIAL FIRST FLOOR PLAN - AREA C PROVIDE UPRIGHT SPRINKLER HEAD UNDER LOWEST LANDING OF  STAIRWELL. OPEN TO ABOVE. REFER TO SECOND FLOOR PLAN FOR SPRINKLER  HEADS. 2 PROVIDE SIDEWALL HEAD TO PROTECT UNDER OVERHEAD DOOR  (WHEN DOOR IS OPEN). 3 GENERAL NOTES: A. COORDINATE ALL SPRINKLER MAINS, BRANCHES AND HEAD LOCATIONS  WITH ALL OTHER TRADES. THE CONTRACTOR SHALL HYDRAULICALLY CALCULATE ALL  SPRINKLER SYSTEMS AND SHALL SIZE THE PIPING ACCORDINGLY. B. PROVIDE FULL SPRINKLER COVERAGE FOR ALL CONCEALED SPACES  PER NFPA 13. C. PROVIDE SPRINKLER HEAD UNDER ALL FIXED OBSTRUCTIONS WIDER  THAN 4'-0"" PER NFPA. D. PROVIDE SPRINKLER HEAD(S) OFF THE DRY SYSTEM WHERE  TEMPERATURE DROPS BELOW 40 DEGREES. E. EXISTING FIRE SERVICE AND BACKFLOW PREVENTER. REFER TO  DETAIL ON DRAWING FP-501. 4 EXISTING FIRE DEPARTMENT CONNECTION (FDC). 5 PROVIDE SPRINKLER HEAD ON EITHER SIDE OF RATED WINDOW PER  NFPA 13 AND THE FIRE CODE. 6 THIS ROOM SHALL BE PROTECTED BY A CLEAN AGENT SYSTEM.  REFER TO DRAWING FP-109. 7 CONCEALED SPRINKLER HEAD TO PROTECT BELOW CEILING  FEATURE. 8 9 PROVIDE SPRINKLER HEAD OFF THE DRY SPRINKLER SYSTEM. ",Fire Protection
"J I G 2.8 2 1 3 H 2.5 1.5 2.2 F.7 H.4 G.6 J.2 COLD VEHICLE STORAGE ENVIRONMENTAL 211 COLD VEHICLE STORAGE COMPLIANCE 212 FILES 210A OFFICE 210 SHARED ENTRY / RECEPTION 200A SECURE PRINTING / FILES / STORAGE 208 VESTIBULE 200 FOOD DISTRIBUTION 209 ENTRY 4 214 STAIR ST-4 SECURE STAMP ROOM 201 COMPLIANCE 206 STAIR ST-3 DIRECTOR'S OFFICE 206A STORAGE 207A DRAFTING/TABLES/FILES 207 PASSAGE 206B STAMP EQPT. ROOM 205 SECURE STORAGE 204 FILES/WORKROOM SECURE PRINTING 203 HAND STAMP 202 TWO STORY COMMON AREA 900 1 1 2 (TYPICAL OF 6) 2 (TYPICAL OF 6) 3 3 3 / 1 FP-101 / 1 FP-104 / 1 FP-103 / 1 FP-103 PLAN  NORTH B A C D KEY PLAN Beardsley Design Associates Architecture, Engineering, Landscape Architecture, D.P.C. © Filename: NOT FOR CONSTRUCTION no. revision description by date Project Number: Drawn By: Designed By: Reviewed By: WARNING Any alterations to this document not  conforming to section 7307. New York State  Education Law are strictly prohibited. 320 West Main Street  Malone, NY 12953 518.483.1585 5789 Widewaters Pkwy Dewitt, NY 13214 315.472.6980 64 South Street Auburn, NY 13021 315.253.7301 AUBURN MALONE SYRACUSE 2/11/2022 3:35:25 PM C:\Users\jcappotelli\Documents\17159 - IGA SRMT MEP Central_jcappotelli.rvt Saint Regis Mohawk Tribe FP-102 2/11/2022 PARTIAL FIRST FLOOR PLAN - AREA B RENOVATIONS OF THE IGA BUILDING 850 NY-37, Hogansburg, NY 13655 CONSTRUCTION DOCUMENTS WAB 18029 NMG NMG DRAWING NOTES: 1 1/8"" = 1'-0"" 1 PARTIAL FIRST FLOOR PLAN - AREA B PROVIDE UPRIGHT SPRINKLER HEAD UNDER LOWEST LANDING OF  STAIRWELL. GENERAL NOTES: A. COORDINATE ALL SPRINKLER MAINS, BRANCHES AND HEAD LOCATIONS  WITH ALL OTHER TRADES. THE CONTRACTOR SHALL HYDRAULICALLY CALCULATE ALL  SPRINKLER SYSTEMS AND SHALL SIZE THE PIPING ACCORDINGLY. B. PROVIDE FULL SPRINKLER COVERAGE FOR ALL CONCEALED SPACES  PER NFPA 13. C. PROVIDE SPRINKLER HEAD UNDER ALL FIXED OBSTRUCTIONS WIDER  THAN 4'-0"" PER NFPA. D. PROVIDE SPRINKLER HEAD(S) OFF THE DRY SYSTEM WHERE  TEMPERATURE DROPS BELOW 40 DEGREES. E. 2 PROVIDE SPRINKLER HEAD OFF THE DRY SPRINKLER SYSTEM. PROVIDE SIDEWALL HEAD TO PROTECT UNDER OVERHEAD DOOR  (WHEN DOOR IS OPEN). 3 ",Fire Protection
"REF. REF. G 2.8 2 1 3 E D O B A 2.5 C.1 2.2 3.4 A.6 E.9 F.7 A.0 FUTURE USER GROUP SPACE 710 SUPERVISED VISITATION COACH 704 SHARED KITCHEN 702 TOILET ROOM 702A APARTMENT SETTING #2 703 STORAGE FILES / SOCIAL SERVICES 706 TWO STORY COMMON AREA 900 GROUP CONFERENCE 701 WOMEN TR-13 MEN TR-14 1 (TYPICAL OF 12) / 1 FP-106 / 1 FP-106 / 1 FP-105 / 1 FP-108 2 2 2 2 2 2 2 2 2 2 2 2 2 2 2 2 2 2 2 LACTATION 707 MECHANICAL 708 APARTMENT SETTING #1 705 ? ? MECHANICAL ROOM 332 3 3 PLAN  NORTH B A C D KEY PLAN Beardsley Design Associates Architecture, Engineering, Landscape Architecture, D.P.C. © Filename: NOT FOR CONSTRUCTION no. revision description by date Project Number: Drawn By: Designed By: Reviewed By: WARNING Any alterations to this document not  conforming to section 7307. New York State  Education Law are strictly prohibited. 320 West Main Street  Malone, NY 12953 518.483.1585 5789 Widewaters Pkwy Dewitt, NY 13214 315.472.6980 64 South Street Auburn, NY 13021 315.253.7301 AUBURN MALONE SYRACUSE 2/11/2022 3:35:45 PM C:\Users\jcappotelli\Documents\17159 - IGA SRMT MEP Central_jcappotelli.rvt Saint Regis Mohawk Tribe FP-107 2/11/2022 PARTIAL SECOND FLOOR PLAN - AREA C RENOVATIONS OF THE IGA BUILDING 850 NY-37, Hogansburg, NY 13655 CONSTRUCTION DOCUMENTS WAB 18029 NMG NMG DRAWING NOTES: 1 1/8"" = 1'-0"" 1 PARTIAL SECOND FLOOR PLAN - AREA C GENERAL NOTES: A. COORDINATE ALL SPRINKLER MAINS, BRANCHES AND HEAD LOCATIONS  WITH ALL OTHER TRADES. THE CONTRACTOR SHALL HYDRAULICALLY CALCULATE ALL  SPRINKLER SYSTEMS AND SHALL SIZE THE PIPING ACCORDINGLY. B. PROVIDE FULL SPRINKLER COVERAGE FOR ALL CONCEALED SPACES  PER NFPA 13. C. PROVIDE SPRINKLER HEAD UNDER ALL FIXED OBSTRUCTIONS WIDER  THAN 4'-0"" PER NFPA. D. PROVIDE SPRINKLER HEAD(S) OFF THE DRY SYSTEM WHERE  TEMPERATURE DROPS BELOW 40 DEGREES. E. PROVIDE SPRINKLER HEAD OFF THE DRY SPRINKLER SYSTEM. 2 PROVIDE TEMPERATURE RATED SPRINKLER HEAD UNDER SKYLIGHT. CONCEALED SPRINKLER HEAD TO PROTECT BELOW CEILING  FEATURE. 3 ",Fire Protection
"UP UP F.E. F.E. F.E. F.E. F.E. F.E. CANOPY ABOVE DN DN SECOND FLOOR FIRE SPRINKLER PLAN 2 N FIRST FLOOR FIRE SPRINKLER PLAN 1 N 6"" FIRE PROTECTION WATER SUPPLY.  REFERENCE CIVIL PLANS FOR CONTINUATION. 4"" TO REMOTE FDC.   REFERENCE CIVIL PLANS FOR CONTINUATION. 6"" WET PIPE FIRE RISER. SHEET NOTES PROVIDE WET PIPE SPRINKLER COVERAGE PER NFPA 13 FOR THE APPROXIMATELY 12,100 SF +/- OFFICE AND LIVING SPACE AREA. PROVIDE WET PIPE SPRINKLER COVERAGE PER NFPA 13 FOR THE APPROXIMATELY 6,275 SF +/- LIVING SPACE AND APPARATUS BAY AREA. 1 2 1 2 SHEET NO: 23-001 PROJECT NO: File Path 23-026 ISSUE DATE DESCRIPTION 2/20/2024 8:51 PM Smith Mechanical Consulting & Design CITY OF SPANISH FORT FIRE RESCUE A NEW CENTRAL STATION FOR 7361 SPANISH FORT BLVD SPANISH FORT, ALABAMA 36527 FIRE SPRINKLER PLAN F200 ",Fire Protection
"FIRE SPRINKLER PLAN - MAIN NORTH SCALE 2 1/8"" = 1’ - 0"" NORTH SCALE 1 1/8"" = 1’ - 0"" FS-01 FIRE SPRINKLER PLAN - MAIN FLOOR FIRE SPRINLER PLAN - MEZZANINE LEVEL 1 2 3 4 5 6 WET-PIPE FIRE SPRINKLER RISER.  SEE DETAIL 1 ON SHEET FS-2. FIRE SPRINKLER KEY NOTES 7 PROVIDE AUXILIARY DRAINS PER NFPA 13 8.16.2 TO FACILITATE DRAINAGE OF TRAPPED PIPING. MAIN BELOW ROOF DECK 2"" DROP TO SUPPLY PIPING BELOW MEZZANINE.  INSTALL TIGHT TO WALL.  CONNECT TO CROSS  SLOPE INSTALL SWING JOINT ON PIPING NEAR ROOF PEAK TO ALLOW PIPING TO BE RUN PARALLEL TO ROOF  8 PLAN) IN ACCORDANCE WITH NFPA 13 8.5.5.3. INSTALL ADDITIONAL FIRE SPRINKLERS TO PROTECT BELOW OVERHEAD DOORS (NOT SHOWN ON  9 BELOW AND PARALLEL TO ROOF DECK. FOR COMBUSTIBLE STORAGE BELOW.  INSTALL SPRINKLER WITH DEFLECTOR APPROXIMATELY 6""  INSTALL DRY SIDEWALL FIRE SPRINKLER TO PROTECT BELOW EXTERIOR CANOPY WITH THE POTENTIAL  10 REQUIRES 34.8 PSI WITH 197.2 GPM FLOWING AT BASE OF FIRE SPRINKLER RISER.    (AREA REDUCED PER USE OF QR SPRINKLERS) WITH 100 GPM HOSE ALLOWANCE.  SYSTEM  HYDRAULIC DESIGN AREA #2 - OFFICE SPACE. LIGHT HAZARD - 0.10 GPM/SQ FT OVER 950 SQ FT  MINUTES. PUMP.  WATER SUPPLY SHALL PROVIDE A MINIMUM OF 60 PSI AT 500 GPM FOR A DURATION OF 60  SUPPLY TO BE PROVIDED BY 28,000 GALLON WATER STORAGE TANK AND 500 GPM ELECTRIC FIRE  NEW 4"" OR 6"" UNDERGROUND FIRE SPRINKLER WATER SUPPLY TO BUILDING BY OTHERS.  WATER  BUILDING.  PROVIDE CHECK VALVE AND AUTOMATIC BALL DRIP. GRADE.  CONNECT TO 3"" FIRE SPRINKLER CROSS MAIN THAT RUNS ALONG SOUTH WALL OF  2-WAY, WALL MOUNTED FIRE DEPARTMENT CONNECTION.  MOUNT AT 36’ ABOVE FINISHED EXTERIOR  RISER.    ALLOWANCE.  SYSTEM REQUIRES 23.7 PSI WITH 469 GPM FLOWING AT BASE OF FIRE SPRINKLER  GPM/SQ FT OVER 1,950 SQ FT (AREA INCREASED 30% FOR ROOF SLOPE) WITH 250 GPM HOSE  HYDRAULIC DESIGN AREA #1 - VEHICLE MAINTENANCE AREA. ORDINARY HAZARD GROUP II - 0.20  11 SUPPLY TO BELL SWITCHED THROUGH WATER FLOW SWITCH AT FIRE SPRINKLER RISER. WATER FLOW BELL.  INSTALL ABOVE FIRE DEPARTMENT CONNECTION.  PROVIDE 120VAC POWER  CHECKED REVISED DRAWN PROJECT DATE SHEET SHEET TITLE 15430 HIGHW AY 44 ITD MAINTENANCE BLDG. IMPROVEMENTS www.cshqa.com 200 BROAD STREET (208) 343-4635    FAX (208) 343-1858 BOISE, ID  83702 Copyright   2023 OF CSHQA OR ITS AFFILIATES. PROJECT-W HEN PHASED-W ITHOUT THE W RITTEN CONSENT  ADDITIONS TO THIS PROJECT, OR COMPLETION OF THIS  ANY PERSON OR ENTITY ON OTHER PROJECTS, FOR  DRAW INGS AND SPECIFICATIONS SHALL NOT BE USED BY  W HICH THEY ARE MADE IS EXECUTED OR NOT. THESE  THE ARCHITECT / ENGINEER W HETHER THE PROJECT FOR  OF SERVICE, ARE AND SHALL REMAIN THE PROPERTY OF  THESE DRAW INGS AND SPECIFICATIONS, AS INSTRUMENTS  C CALDW ELL, IDAHO 22123.00 06/05/23 ORIGINAL SHEET SIZE 30"" x 42"" PHONE: 208-343-4635    FAX: 208-343-1858 BOISE, IDAHO  83702 200 BROAD STREET JAMES MARSH, ARCHITECT GTJ NMJ 06/05/23 102 CONFERENCE   101 CORRIDOR   116 SHOP AREA   105 UNISEX   104 BREAK RM.   106 I.T. CLOSET   109 OFFICE OPEN 119 STORAGE MECHANIC 112 ROOM DECON 110 UNISEX   111 UNISEX   107 UNISEX   108 COPY   118 OFFICE MECHANIC 114 STORAGE FIELD SUPPLIES 115 STORAGE OFFICE 113 SUPPLIES SHOP 117 CLOSET JANITOR 103 OFFICE   205 MECH   201 SPACE WORK 204 OFFICE FOREMAN 202 ROOM BREAK 203 LOCKERS   207 UNISEX   2"" x 0’-6"" 2"" x 0’-6"" 2"" x 0’-6"" 2"" x 0’-6"" 2"" x 0’-6"" 2"" x 0’-6"" 2"" x 0’-6"" 2"" x 0’-6"" 2"" x 0’-6"" 2"" x 0’-6"" 2"" x 0’-6"" 2"" x 0’-6"" 2"" x 0’-6"" 2"" x 0’-6"" 2"" x 0’-6"" 2"" x 0’-6"" 4"" 4"" 4"" 4"" 4"" 4"" 4"" 4"" 4"" 4"" 4"" 4"" 4"" 4"" 4"" 4"" 4"" 4"" 3"" 3"" 3"" 3"" 3"" 3"" 3"" 3"" 3"" 3"" 3"" 3"" 3"" 3"" 3"" 2"" 2"" 2"" 2"" 2"" 2"" 2"" 2"" 2"" 2"" 2"" 2"" 1"" 1"" 1"" 1"" 1"" 1"" 1"" 2"" 2"" 2"" 2"" 2"" 2"" 2"" 2"" 2"" 2"" 2"" 2"" 2"" 2"" 2"" 2"" 2"" 2"" 2"" 2"" 2"" 2"" 2"" 2"" 2"" 2"" 2"" 2"" 2"" 2"" 2"" 2"" 2"" 2"" 2"" 2"" 2"" 2"" 2"" 2"" 2"" 2"" 2"" 2"" 2"" 2"" 2"" 2"" 2"" 2"" 2"" 2"" 1"" 2"" 2"" 2"" 2"" 2"" 2"" 2"" 1"" 2"" 2"" 2"" 2"" 2"" 2"" 2"" 2"" 2"" 1"" 1"" 1"" 1"" 1"" 1"" 1"" 1"" 1"" 1"" 1"" 1"" 1"" 1"" 1"" 1"" 1"" 1"" 1-1/4"" 1-1/4"" 1-1/2"" 1-1/2"" 1-1/2"" 1-1/2"" 1"" 1-1/4"" 1-1/4"" 1-1/2"" 1-1/2"" 2"" 2"" 2"" 1"" 1"" 1-1/4"" 1-1/4"" 1-1/2"" 4"" OR 6"" 2"" 2"" 1 2 3 4 5 6 7 8 9 A B A2 0.A 0.A A1 7 8 9 A B SYMBOL DESCRIPTION VERTICAL TRANSITION FOR PIPING PIPE CAP/FLUSHING CONNECITON HYDRAULIC CALCULAITON NODE POINT WET-PIPE FIRE SPRINKLER RISER WALL MOUNT FIRE DEPARTMENT CONNECTION VERTICAL RISE FROM HORIZONTAL PIPE VERTICAL DROP FROM HORIZONTAL PIPE PIPING ELEVATION ABOVE FINISHED FLOOR OR BELOW DECK FIRE SPRINKLER SYMBOL LEGEND LINE TEMPERATURE, BRASS, UPRIGHT FIRE SPRINKLER ON EXPOSED BRANCH  QUICK RESPONSE, STANDARD ORIFICE (K-5.6), ORDINARY  CHROME, RECESSED TYPE ESCUTCHEON TEMPERATURE, CHROME PLATED, PENDENT FIRE SPRINKLER WITH  QUICK RESPONSE, STANDARD ORIFICE (K-5.6), ORDINARY  LINE TEMPERATURE, BRASS, UPRIGHT FIRE SPRINKLER ON EXPOSED BRANCH  STANDARD RESPONSE, LARGE ORIFICE (K-8.0), INTERMEDIATE  CHROME ESCUTCHEON TEMPERATURE, CHROME PLATED, DRY SIDEWALL FIRE SPRINKLER WITH  QUICK RESPONSE, STANDARD ORIFICE (K-5.6), ORDINARY  EXPOSED BRANCH LINE TEMPERATURE, CHROME PLATED, SIDEWALL FIRE SPRINKLER ON  QUICK RESPONSE, STANDARD ORIFICE (K-5.6), ORDINARY  AUXILIARY DRAIN 15’-9"" AFF 15’-9"" AFF 15’-9"" AFF 15’-9"" AFF 12’-0"" AFF 12’-0"" AFF 12’-0"" AFF 8’-6"" AFF 8’-6"" AFF 7’-6"" AFF 7’-6"" AFF 7’-6"" AFF 7’-6"" AFF 1’-0"" BD 1’-0"" BD 1’-0"" BD 1’-0"" BD 1’-0"" BD 1’-0"" BD 1’-0"" BD 1’-0"" BD 1’-0"" BD 1’-0"" BD 1’-0"" BD 1’-0"" BD X’-X"" AFF/BD 1 2 3 4 5 6 7 7 7 7 7 7 7 7 7 8 8 8 9 10 11 101 102 103 104 105 106 107 108 114 113 112 111 110 109 120 119 118 117 116 115 201 202 203 204 205 206 207 208 209 210 211 C B A E D 1 2 3 4 5 6 7 8 9 10 11 12 13 14 15 16 17 18 19 20 21 22 23 24 25 26 27 28 29 30 31 32 33 34 35 37 36 38 39 40 41 42 43 44 X ",Fire Protection
"UP UP DN UP FE N R R A MANUAL PULL STATION SMOKE DETECTOR DUCT SMOKE DETECTOR A FIRE SERVICE LINE R A SPRINKLER FLOW SWITCH TAMPER SWITCH A STANDPIPE FLOW R ELEVATOR LOBBY SMOKE DETECTOR R ELEVATOR CONTROL ROOM ALARM DEVICES G EPO LAMP TEST TROUBLE SILENCE RESET SWITCH SYSTEM CONTROL FIRE ALARM ANNUNCIATOR PANEL GENERATOR RUN EMERGENCY SYSTEM GROUND FAULT BATTERY CHARGER NOT FUNCTIONING GENERATOR NOT IN AUTOMATIC MODE FLOORS SYSTEM CONTROL G A G A A A G A A A R SYSTEM TROUBLE POWER ON FIRE PUMP RUN FIRE PUMP FAULT FIRE PUMP DISCONNECT OPEN FIRE PUMP NOT IN AUTOMATIC MODE SPARE R R R R SECOND FLOOR FIRST FLOOR FAAP FIRE ALARM ANNUNCIATOR PANEL FACP FIRE ALARM CONTROL PANEL ABBREVIATIONS ANNUNCIATOR RED LAMP GREEN LAMP AMBER LAMP KEY PUSH BUTTON KEY SWITCH FIRE  ALARM  OPERATIONAL MATRIX * * * * AREA/ROOM SMOKE DETECTOR DUCT SMOKE DETECTOR WATER FLOW SWITCH MONITOR SWITCH (VALVE TAMPER) MANUAL PULL STATION SMOKE DETECTOR AT ELEVATOR LOBBY ELEVATOR SHAFT SMOKE DETECTOR ELEVATOR SHAFT HEAT DETECTOR GENERAL EVACUATION ALARM OUTPUT TO FIRE ALARM SYSTEM AUDIBLE & VISUAL ALARM SIGNAL AT FACP AUDIBLE & VISUAL SUPERVISORY SIGNAL AT FACP OUTPUT SIGNAL TO ELEVATOR CONTROLLER FOR ELEVATOR RECALL OUTPUT SIGNAL FOR ELEVATOR POWER SHUTDOWN OUTPUT SIGNAL TO SHUT DOWN AIR HANDLING UNIT SYSTEMS INPUT SYSTEMS OUTPUT FIRE PUMP RUNNING SIGNAL FIRE PUMP LOSS OF PHASE SIGNAL FIRE PUMP PHASE REVERSAL SIGNAL BUZZER   UNDER FIRE CONDITION - ELEVATOR EMERGENCY OPERATION SHALL BE AS FOLLOWS: A. ELEVATOR SHAFT SMOKE DETECTORS SHALL ACTIVATE RECALL OF ELEVATOR WITHIN SHAFT, SOUND GENERAL ALARM, ANNUNCIATE APPROPRIATE LAMPS AT ANNUNCIATOR PANEL. B. ELEVATOR MACHINE ROOM SMOKE DETECTOR SHALL ACTIVATE RECALL OF ELEVATOR, SOUND GENERAL ALARM, ANNUNCIATE APPROPRIATE LAMPS AT ANNUNCIATOR PANEL. C. ELEVATOR SHAFT HEAT DETECTORS SHALL DISCONNECT POWER TO ELEVATOR MOTOR WITHIN THAT SHAFT AND ANNUNCIATE TROUBLE AT ANNUNCIATOR PANEL. D. ELEVATOR MACHINE ROOM HEAT DETECTOR SHALL DISCONNECT POWER TO ELEVATOR AND ANNUNCIATE TROUBLE AT ANNUNCIATOR PANEL. E. ELEVATOR MACHINE ROOM SPRINKLER FLOW SWITCH SHALL SOUND GENERAL ALARM, ANNUNCIATE APPROPRIATE LAMPS AT ANNUNCIATOR PANEL AND DISCONNECT ELEVATOR POWER. R G A TRANSMIT ALARM TO SCC TRANSMIT TROUBLE TO SCC TRANSMIT SUPERVISORY SIGNAL TO SCC ACTUATE COMMON TROUBLE SIGNAL INDICATOR TO FACP ACTUATE AUDIBLE COMMON TROUBLE SIGNAL TO FACP FIRE ALARM AC POWER FAILURE FIRE ALARM SYSTEM LOW BATTERY OPEN CIRCUIT GROUND FAULT NOTIFICATION APPLIANCE CIRCUIT SHORT FIRST FLOOR BASEMENT SPARE HOLABIRD ACADEMY 200 E North Ave room 407A Baltimore MD 21012 SECOND FLOOR A HEAT DETECTOR R ELEVATOR CONTROL ROOM SMOKE DETECTOR A A A A STAIR 1 STAIR 2 STAIR 3 STAIR 5 A SPARE A SPARE ALARM SIGNAL DEACTIVATION SUPERVISORY SYSTEM SILENCE EMERGENCY GENERATOR ON AUTO RUNNING R OFF MH MOUNTING HEIGHT AFF ABOVE FINISHED FLOOR BASEMENT R SPARE YOU ARE HERE FAAP R ZONE -3 R ZONE -4 R ZONE -2 R ZONE -1 FACP STAIR 3 STAIR 2 ELEVATOR STAIR 1 STAIR 5 ELECTRICAL ROOM ELECTRICAL ROOM EMERGENCY ELECTRICAL ROOM FIRE DEPARTMENT CONNECTION R ZONE -5 R ZONE -6 STAIR 3 STAIR 2 ELEVATOR STAIR 1 STAIR 5 ELEVATOR CONTROL ROOM R ZONE -7 R ZONE -8 STAIR 2 1 2 3 4 5 6 7 8 9 10 11 12 13 14 15 16 17 18 11720 Beltsville Drive Suite 600 Calverton, MD 20705 Tel: 301.595.1000 1 2 3 4 5 6 7 8 9 10 11 12 13 14 15 16 17 18 A B C D E F G H J K L M A B C D E F G H J K L M © GRIMM AND PARKER, P.C. 2014 © GRIMM AND PARKER, P.C. 2014 www.grimmandparker.com HOLABIRD ACADEMY PK-8 CITY OF BALTIMORE, MARYLAND GP# 21553 M/E/P/FP DESIGN ENGINEERING • PROJECT MANAGEMENT ENERGY MANAGEMENT SERVICES • DESIGN-BUILD SERVICES CONSTRUCTION MANAGEMENT • COMMISSIONING DISTRICT OF COLUMBIA • MARYLAND NEW YORK • VIRGINIA www.SETTY.com PROJECT NUMBER: TM ONE SOUTH STREET, SUITE 1130 BALTIMORE, MARYLAND 21202 TEL: 667-309-6036 E-5.3H FIRE ALARM ANNUNICATOR PANEL 03/13/2017 BID SET SAXXYY###.## DATE DESCRIPTION ",Fire Protection
"315 313 311 309 307 316 314 312 310 308 305 303 301 306 304 302 319 321 223 RE RE RE RE RE RE RE RE RE RE RE RE RE RE RE RE RE RE RE RE RE WF TS E E 317 320 322 324 318 NAC NAC RE RE EXISTING SPRINKLER RISER RE RE RE TS E EXISTING SPRINKLER STANDPIPE RISER TS E EXISTING SPRINKLER STANDPIPE RISER EXISTING MECH ROOF TOP UNIT 3,800CFM VERIFY LOCATION IN FIELD. RE RE EXISTING ELEVATOR HOISTWAY HEAT DETECTOR. VERIFY LOCATION IN FIELD. SD SD SD SD SD SD SD CO SD SD SD SD SD SD SD SD RE RE RE SD FIRE ALARM 3RD FLOOR PLAN FA5.03 240801-FA5.03 FIRE ALARM 3RD FLOOR.dwg 1/8/2025 1:1.02236 DRAWN CHECKED TWE JOB # CLIENT JOB # 240801 KI2300365 SHEET NUMBER SHEET TITLE ISSUED DATE PROJECT ADDRESS PROJECT TITLE SHEET SCALE BID SET 01/08/2025 DRAWING ISSUE NOTE REVISION DATE REV NOTE DATE REV NOTE DATE REV NOTE DATE KING COUNTY HOUSING AUTHORITY YARDLEY ARMS APARTMENTS FIRE ALARM SYSTEM REPLACEMENT T R E S   W E S T   E N G I N E E R S,   I N C. 2702 SOUTH 42ND STREET, SUITE 301 TACOMA, WA 98409-7315 Phone: 253.472.3300 www.treswest.com 01/08/2025 RWA BCY BURIEN, WA. 98146 1006 SW. 130TH ST. PLAN NOTES 501 PROVIDE FIRE ALARM MONITOR DEVICES ON PLATE AS REQUIRE BY CODE FOR THE SPRINKLER RISER. CONNECT TO NEAREST EXISTING FIRE ALARM DEVICE. PROVIDE J-BOXES, CONDUIT, CABLING, AND CONNECTIONS AS REQUIRED FOR A COMPLETE OPERATIONAL SYSTEM. REFER TO FIRE ALARM DIAGRAM. ### 1. EQUIPMENT AND DEVICES SHOWN DASHED DARK AND WITH A (RE) ARE EXISTING TO BE DEMO OR REPLACED, UNLESS NOTED OTHERWISE. REPLACE EXISTING FIRE ALARM DEVICE WITH NEW ADDRESSABLE FIRE ALARM DEVICE. MAINTAIN EXISTING FIRE ALARM J-BOXES, AND CONDUIT AS REQUIRE BACK TO THE NEW FIRE ALARM PANEL. 2. EQUIPMENT AND DEVICES SHOWN LIGHT AND WITH A (E) ARE EXISTING TO REMAIN, UNLESS NOTED OTHERWISE. PROVIDE NEW INTERFACE MODULES AS REQUIRED TO RECONNECT IS EXISTING EQUIPMENT OR DEVICE. PROVIDE J-BOXES, CONDUIT, CABLING, AND CONNECTIONS AS REQUIRED FOR A COMPLETE OPERATIONAL SYSTEM. 3. ALL WORK SHALL COMPLY WITH THE LATEST NEC AND LOCAL CODE AND EXCEED CODE REQUIREMENTS WERE CALLED OUT BY KCHA PLANS AND SPECIFICATION. 4. ALL EMPTY CONDUITS SHALL INCLUDE PULL STRING. 5. UNLESS NOTED OTHERWISE ALL WIRING SHALL BE IN GALVANIZED RIGID STEEL OR EMT CONDUIT WITH MINIMUM TRADE SIZE OF 3/4-INCH. 6. COORDINATE ALL WORK WITH OWNER REPRESENTATIVE FOR WORK SCHEDULES DETAILS PRIOR TO DECOMMISSIONED, DEMOLITION, RELOCATION, SHUT DOWN OF FIRE ALARM PANELS AND PANELBOARDS & ETC. 7. PROVIDE PATCH AND PAINT AS REQUIRED FOR ALL NEW EQUIPMENT AND DEVICES. 8. PROVIDE ELECTRICAL AND FIRE ALARM WORK ACCORDING TO CONSTRUCTION PHASING SCHEDULES. AT THE END OF EACH AREA OF CONSTRUCTION PER PHASING PLANNING SCHEDULE, PROVIDE ELECTRICAL AND FIRE ALARM TESTING TO INSURE COMPLETION OF WORK IS SATISFACTORY FOR ACCEPTANCE. GENERAL REQUIREMENT NOTES 502 REFER TO TYPICAL FOR ALL DWELLING UNITS LAYOUT FLOOR PLAN SHEET FA5.01 & FA5.02. 501 502 TYPICAL 502 TYPICAL 502 TYPICAL 502 TYPICAL 502 TYPICAL SD D 502 TYPICAL 3/32""=1'-0"" SCALE: FIRE ALARM 3RD FLOOR PLAN SEE SHEET 506 REFER TO FIRE ALARM ASSESSMENT REPORT EXISTING FIRE ALARM SYSTEM INTERFACE INFORMATION SECTION #3 DUCT DETECTOR FOR ADDITIONAL INFORMATION. 506 100% BID SET ",Fire Protection
"REF. J I G F 3.5 4 4.2 5 6 H E 4.5 3.4 E.9 F.7 H.4 G.6 3.7 J.2 OFFICE #1 508 SERVER 503A DIRECTOR 507 CORRIDOR 503 MANAGER OFFICE 506 FAMILY ADVOCATE 505 FIRE PROOF STORAGE 511 OFFICE #3 510 OFFICE #2 509 TVR RESOURCE AND SHARED CONFERENCE 514 CORRIDOR 521 TVR STORAGE 516 CFS STORAGE 515 CENTRAL COPY 512 FAMILY ADVOCATE 504 WAITING 501 CENTRAL BREAK 513 ADMINISTRATIVE ASSISTANT 502 COUNCIL #2 517 FUTURE TRV 518 COUNSELOR #3 520 COUNCIL #1 519 WAITING 522 ADMINISTRATIVE ASSISTANT 523 TVR MANAGER 524 ELEVATOR EL-1 ELEVATOR EL-2 CLOSET 525A CORRIDOR 525 OFFICE #1 527 ELEVATOR LOBBY 500 STAFF AREA/WAITING 526 TRIBAL COURT 106 ENTRY LOBBY L-1 CORRIDOR 500C MEN TR-11 WOMEN TR-10 JANITOR CLOSET 500B STUDIO 530 TECH SUPPORT 533 SUPERVISOR 611 OFFICE 610 OFFICE 609 STORAGE 607A ICWA STORAGE 604A CORRIDOR 500C OPEN OFFICE 604 CONTROL/SOUND 531 GREEN/MEETING 529 EDITING 532 OFFICE #2 528 TWO STORY COMMON AREA 900 / 2 FP-101 MAIN ENTRY VESTIBULE 100 1 (TYPICAL OF 13) / 1 FP-106 / 1 FP-107 / 1 FP-108 2 2 2 2 DATA CLOSET 533A 2 STORAGE 500A PLAN  NORTH B A C D KEY PLAN Beardsley Design Associates Architecture, Engineering, Landscape Architecture, D.P.C. © Filename: NOT FOR CONSTRUCTION no. revision description by date Project Number: Drawn By: Designed By: Reviewed By: WARNING Any alterations to this document not  conforming to section 7307. New York State  Education Law are strictly prohibited. 320 West Main Street  Malone, NY 12953 518.483.1585 5789 Widewaters Pkwy Dewitt, NY 13214 315.472.6980 64 South Street Auburn, NY 13021 315.253.7301 AUBURN MALONE SYRACUSE 2/11/2022 3:35:38 PM C:\Users\jcappotelli\Documents\17159 - IGA SRMT MEP Central_jcappotelli.rvt Saint Regis Mohawk Tribe FP-105 2/11/2022 PARTIAL SECOND FLOOR PLAN - AREA A RENOVATIONS OF THE IGA BUILDING 850 NY-37, Hogansburg, NY 13655 CONSTRUCTION DOCUMENTS WAB 18029 NMG NMG DRAWING NOTES: 1 1/8"" = 1'-0"" 1 PARTIAL SECOND FLOOR PLAN - AREA A GENERAL NOTES: A. COORDINATE ALL SPRINKLER MAINS, BRANCHES AND HEAD LOCATIONS  WITH ALL OTHER TRADES. THE  CONTRACTOR SHALL HYDRAULICALLY CALCULATE ALL  SPRINKLER SYSTEMS AND SHALL SIZE THE PIPING ACCORDINGLY. B. PROVIDE FULL SPRINKLER COVERAGE FOR ALL CONCEALED SPACES  PER NFPA 13. C. PROVIDE SPRINKLER HEAD UNDER ALL FIXED OBSTRUCTIONS WIDER  THAN 4'-0"" PER NFPA. D. PROVIDE SPRINKLER HEAD(S) OFF THE DRY SYSTEM WHERE  TEMPERATURE DROPS BELOW 40 DEGREES. E. PROVIDE SPRINKLER HEAD OFF THE DRY SPRINKLER SYSTEM. THIS ROOM SHALL BE PROTECTED BY A CLEAN AGENT SYSTEM.  REFER TO DRAWING FP-109. 2 ",Fire Protection
