text,label
"10 10 10 10 10 10 10 10 10 10 10 10 10 10 10 10 10 10 10 10 10 10 10 10 10 10 10 10 10 10 10 10 10 10 10 10 10 10 10 10 10 10 10 10 10 10 10 10 10 10 10 10 10 10 10 10 10 10 10 10 10 10 10 11 11 11 11 11 11 11 11 11 11 11 11 11 11 11 11 11 11 11 11 11 11 11 11 11 11 11 11 11 11 11 11 11 11 11 11 11 11 11 11 11 11 11 11 11 11 11 11 11 11 11 11 11 11 11 11 11 11 11 11 11 11 11 11 11 11 11 11 11 11 11 11 11 11 11 11 11 11 9 9 9 9 9 9 9 9 9 9 9 9 9 9 9 9 9 9 9 9 9 9 9 9 9 9 9 9 9 9 9 9 9 9 9 9 9 9 9 9 9 9 9 10 10 10 10 10 10 10 10 10 10 10 10 10 10 10 10 10 10 10 10 10 10 10 10 10 10 10 10 10 10 10 10 10 10 10 10 10 10 10 10 10 10 10 10 10 10 10 10 10 10 10 10 10 10 10 10 10 10 10 10 10 10 10 10 10 10 14 14 14 14 14 14 14 14 14 14 14 14 14 14 14 14 14 14 14 14 14 14 14 14 14 14 14 14 14 14 14 14 14 14 14 14 14 14 14 14 14 14 14 14 14 14 14 14 14 14 14 14 14 14 14 14 14 14 14 14 14 14 14 14 14 14 14 14 14 14 14 14 14 14 14 14 14 14 14 14 14 14 14 14 14 14 14 14 14 14 14 14 14 14 14 14 14 14 14 14 14 14 14 14 14 14 14 14 14 14 14 14 14 14 14 14 14 14 14 14 14 14 14 14 14 14 14 14 14 14 14 14 14 14 14 14 14 14 14 14 14 14 9 9 14 14 14 14 14 14 14 13 13 13 13 13 13 13 13 13 13 13 13 13 13 13 13 12 12 12 12 12 12 12 12 12 12 12 12 12 12 12 12 12 12 12 12 12 12 12 12 13 13 13 13 13 13 13 13 13 13 13 13 13 13 13 13 12 12 12 12 12 12 12 12 12 12 12 12 12 12 12 12 12 12 12 12 12 12 12 12 13 13 12 12 12 13 13 12 12 12 13 13 12 12 12 13 13 12 12 12 13 13 12 12 12 13 12 12 12 13 13 12 12 12 13 12 12 12 13 13 12 12 12 13 12 12 12 13 13 12 12 12 13 12 12 12 13 13 12 12 12 13 12 12 12 13 13 12 12 12 13 12 12 12 13 13 12 12 12 13 12 12 12 13 13 12 12 12 13 12 12 12 13 13 12 12 12 13 12 12 12 13 13 13 13 13 13 13 13 13 11 11 11 11 11 11 11 11 11 11 11 11 11 11 11 11 11 11 11 11 11 11 11 11 11 11 11 11 11 11 11 11 11 11 11 11 11 11 11 11 11 11 11 11 11 11 11 11 11 11 11 13 13 13 13 13 13 13 13 13 13 13 13 13 13 13 13 13 13 13 14 14 14 14 14 10 10 10 10 10 10 10 10 10 10 10 13 13 13 13 13 13 13 13 13 13 13 13 13 13 13 13 13 13 13 14 14 14 14 14 14 14 14 14 14 14 14 14 14 14 14 14 14 14 14 13 12 12 13 12 12 13 13 11 11 11 10 10 10 10 10 10 10 10 E11 13 12 13 12 14 14 14 14 E15 10 11 11 11 11 11 11 11 11 11 11 11 11 10 10 9 9 9 9 9 9 9 9 9 9 10 10 10 10 10 10 10 10 10 14 14 14 14 E19 E20 E12 E22 E21 E13 E14 AREA B AREA C AREA A N 1 2 3 4 5 6 7 8 9 10 11 12 13 14 15 16 17 18 11720 Beltsville Drive Suite 600 Calverton, MD 20705 Tel: 301.595.1000 1 2 3 4 5 6 7 8 9 10 11 12 13 14 15 16 17 18 A B C D E F G H J K L M A B C D E F G H J K L M © GRIMM AND PARKER, P.C. 2014 © GRIMM AND PARKER, P.C. 2014 www.grimmandparker.com HOLABIRD ACADEMY PK-8 CITY OF BALTIMORE, MARYLAND GP# 21553 KEYPLAN 2429 Members Way Lexington, Ky 40504 Tel: 859.253.0892 http://www.cmtaegrs.com/ W-1.1A PHOTOVOLTAICS - ROOF AREA A 03/13/2017 BID SET 4' 8' 32' 16' 0 1/8"" = 1'-0"" 24' 2' SCALE:  1/8"" = 1'-0"" Roof Plan - Photovoltaics - Area A 1 TAGGED NOTES E11 PROVIDE COMBINATION COMBINER BOX / RAPID SHUTDOWN DEVICE FOR SUBARRAY #10.  CONNECT TO SUBARRAY #11 AND EXTEND TO INVERTER #10 IN PENTHOUSE ACCORDINGLY. PROVIDE ECOLIBRIUM SOLAR ECOMOUNT FOR COMBINATION COMBINER BOX / RAPID SHUTDOWN DEVICE; PROVIDE UNI-STRUT AS NECESSARY FOR MOUNTING PURPOSES. E12 PROVIDE COMBINATION COMBINER BOX / RAPID SHUTDOWN DEVICE FOR SUBARRAY #11.  CONNECT TO SUBARRAY #11 AND EXTEND TO INVERTER #11 IN PENTHOUSE ACCORDINGLY. PROVIDE ECOLIBRIUM SOLAR ECOMOUNT FOR COMBINATION COMBINER BOX / RAPID SHUTDOWN DEVICE; PROVIDE UNI-STRUT AS NECESSARY FOR MOUNTING PURPOSES. E13 PROVIDE COMBINATION COMBINER BOX / RAPID SHUTDOWN DEVICE FOR SUBARRAY #12.  CONNECT TO SUBARRAY #12 AND EXTEND TO INVERTER #12 IN PENTHOUSE ACCORDINGLY. E14 PROVIDE COMBINATION COMBINER BOX / RAPID SHUTDOWN DEVICE FOR SUBARRAY #13.  CONNECT TO SUBARRAY #13 AND EXTEND TO INVERTER #13 IN PENTHOUSE ACCORDINGLY. E15 PROVIDE COMBINATION COMBINER BOX / RAPID SHUTDOWN DEVICE FOR SUBARRAY #14.  CONNECT TO SUBARRAY #11 AND EXTEND TO INVERTER #14 IN PENTHOUSE ACCORDINGLY. PROVIDE ECOLIBRIUM SOLAR ECOMOUNT FOR COMBINATION COMBINER BOX / RAPID SHUTDOWN DEVICE; PROVIDE UNI-STRUT AS NECESSARY FOR MOUNTING PURPOSES. E19 REFER TO ARCHITECTURAL PLANS AND PV SPECIFICATIONS FOR CANOPY PV ALTERNATE FOR THIS AREA. E20 REFER TO ARCHITECTURAL PLANS AND PV SPECIFICATIONS FOR CANOPY PV ALTERNATE FOR THIS AREA. E21 PROVIDE COMBINATION COMBINER BOX / RAPID SHUTDOWN DEVICE FOR SUBARRAY #19.  CONNECT TO SUBARRAY #11 AND EXTEND TO INVERTER #19 IN PENTHOUSE ACCORDINGLY. PROVIDE ECOLIBRIUM SOLAR ECOMOUNT FOR COMBINATION COMBINER BOX / RAPID SHUTDOWN DEVICE; PROVIDE UNI-STRUT AS NECESSARY FOR MOUNTING PURPOSES. E22 PROVIDE COMBINATION COMBINER BOX / RAPID SHUTDOWN DEVICE FOR SUBARRAY #20.  CONNECT TO SUBARRAY #11 AND EXTEND TO INVERTER #20 IN PENTHOUSE ACCORDINGLY. PROVIDE ECOLIBRIUM SOLAR ECOMOUNT FOR COMBINATION COMBINER BOX / RAPID SHUTDOWN DEVICE; PROVIDE UNI-STRUT AS NECESSARY FOR MOUNTING PURPOSES. DATE DESCRIPTION ",Architectural
"WOOD PLANK BENCH WOOD PLANK BENCH SOFA SINK LOCKER MODULAR SINGLE BED W/ DESK TELEVISION WC. F.D. DESK ISOLATION RM 3. w/ T&B AREA: 12.0sq.mtrs. T&B ACU FLOATING SHELF SOFA SINK LOCKER MODULAR SINGLE BED W/ DESK TELEVISION SHO. WC. F.D. DESK ISOLATION RM. 2 w/ T&B AREA: 12.0sq.mtrs. T&B ACU FLOATING SHELF SOFA SINK LOCKER MODULAR SINGLE BED W/ DESK TELEVISION WC. F.D. DESK ISOLATION RM. 1 w/ T&B AREA: 12.0sq.mtrs. T&B ACU FLOATING SHELF NICHE NICHE NICHE SHO. SHO. WOOD PLANK BENCH VERANDA EL. + 00.37 EL. + 00.395 VERANDA EL. + 00.37 EL. + 00.395 VERANDA EL. + 00.37 EL. + 00.395 EL. + 00.37 EL. + 00.37 EL. + 00.37 1 2 3 4 1 2 3 4 B A B A FLOATING SHELF FLOATING SHELF FLOATING SHELF A-400 1 A-400 3 A-400 2 A-400 4 PLANT BOX PLANT BOX PLANT BOX 1 DW 1 DW 1 DW 1 D 1 D 1 D 2 W 2 W 2 W 1 W 1 W 1 W SLOPE SLOPE SHEET NO. PROJECT NO.  REVISIONS SHEET CONTENT  CHECKED  BY: REVIEWED AND VERIFIED BY: PROJECT TITLE: LOCATION: APPROVED BY: Drawings and specifications and other contract documents duly signed, stamped or sealed, as instruments of service, are the intellectual property and documents of the architect, whether the object for which they are made is executed or not. It shall be unlawful for any person to duplicate or make copies of said documents for use in the repetition of and for other projects or buildings, whether executed partly or in whole, without the written consent of the architect or author of said documents. A-200 SCALE A3 A1 AS SHOWN 1:60 MTS ROOF PLAN SCALE: PROPOSED A-200 2 1:60 MTS GROUND FLOOR PLAN SCALE: PROPOSED A-200 1 PRK. BUMANAAG, BRGY.ZONE III, KORONADAL CITY, SOUTH COTABATO, FO XII ENGR. FRANCIS C. ESTOMATA ENGR. CRESSYL ANN E. BANTAYA PDO III TECHNICAL FACILITATOR CEZARIO JOEL C. ESPEJO REGIONAL DIRECTOR DSWD - FIELD OFFICE XII PREPARED BY: RRCY, BRGY. BUKAY PAIT, TANTANGAN, SOUTH COTABATO ENGR. ROLLY A. TEOFILO PDO IV FOR INFRA CONSTRUCTION OF 2-UNITS ISOLATION BUIDLING (11-ROOMS) ",Architectural
"ER OS LR ER ER OS ER ER OS ER ER LR ER OS OS OS OS OS OS OS ER OS ER ER ER ER OS ER ER ER ER ER ER ER ER ER ER ER ER ER ER ER ER ER ER ER ER ER OS LR LR LR LR LR LR LR LR LR OS OS LR LR OS LR OS LR LR OS LR LR ER LR LR LR LR LR LR ER LR ER OS ER LR ER LR LR OS LR LR LR LR LR LR LR LR LR LR ER OS OS OS ER OS OS LR LR ER ER ER ER ER ER ER ER ER ER ER ER ER ER ER ER ER ER ER ER ER ER ER ER ER ER ER ER ER ER ER ER ER ER OS OS LR LR P ER ER OS P P P P P P P P P P P P P P P P H J 11 L N 8 A3 12 F G.9 10 9.1 Q AA DD 13 EE A1 A2 A4 A5 M.1 8.2 L.6 9 K 11.4 J.1 EX4 EXB EXC G.2 .OS A3 .OS .OS .OS .OS .OS A3 A1 A1 A1 F1 F1 .OS A3 A3 A1 A1 A1 .OS A2 .OS .OS .OS A3 A5 .OS .OS .OS .OS A3 .OS .OS .OS .OS G G G G L3 L3 L3 L3 L3 L3 L3 L3 A3 A3 A1 A1 A3 A3 A3 A3 A3 N1 N1 N1 N1 N1 N1 A1 C120 CORRIDOR 1200 WAITING/RECEPTION 1203 RECORDS STORAGE 1303 FURNITURE STORAGE 1302 MEN 1301 WOMEN 1206 MECH C120 CORRIDOR 1009 STAFF TOILET 1010 STORAGE 1210 STAFF TOILET 1208 ELECTRICAL 1011 LAUNDRY 1012 PERSONAL CARE C130 CORRIDOR 1102A STORAGE 1102 HEALTH OFFICE 1104 EXAM/TREATMENT 1106 EXAM/TREATMENT C100 CORRIDOR 1004 CONFERENCE C100 CORRIDOR 1001 A.P. OFFICE 1000 RECEPTION 1105 REST AREA 1103 REST AREA 1101 STUDENT TOILET 1002 WORKROOM 1003 CLOSET 1100 WAITING 1400 LOCKERS/SHOWER/ TOILET 1402 WATER SERVICE 1407 ELECTRICAL 1405 EMERGENCY ELECTRICAL 1403 CUSTODIAL C140 CORRIDOR 1304 PLATFORM ST51 STAIR 5 1302A CUSTODIAL 1304A PLATFORM STORAGE 1410 TOILET 1406 CENTRAL STORAGE 1408x RECEIVING 1419 CORRIDOR 1409 OFFICE 1411 SOAP STORAGE E100 CAN WASH 1416 WALK-IN FREEZER 1412 KITCHEN 1414 DISH/TRAY RETURN 1300 DINING 1413 SERVING 1417 DRY STORAGE 1415 WALK-IN COOLER C130 CORRIDOR V100 VESTIBULE .OS A1 A1 A1 .OS A3 A1 A3 A3 J1 .OS .OS .OS .OS R R R R R R R R .OS .OS .OS .OS .OS .OS .OS .OS .OS .OS .OS F1 F1 F1 F7 F1 F1 F1 F1 B B 1700 MEDIA CENTER A1 A3 A3 A3 A3 A3 A3 A3 A3 A3 A3 A3 A3 A5 A5 A5 .OS F4 A1 A1 N1 N1 N1 N1 N1 N1 1005 SECURE STORAGE A3 R R R R 1205 PSYCHOLOGIST 1207 FLEX OFFICE 1209 OFFICE 1211 OFFICE 1008 FLEX OFFICE 1007 FLEX OFFICE 1006 PRINCIPAL E102 OUTDOOR STORAGE E101 OUTDOOR STORAGE 1204 SOCIAL WORKER 1201 CONFERENCE 1601 CONFERENCE 1607 TOILET 1604 FAMILY RESOURCE ROOM 1603 OFFICE 1602 OFFICE 1600 COMMUNITY LEARNING CENTER 1501 SECURITY OFFICE 1511 P.E. OFFICE .OS A3 A3 .OS A3 A3 A3 A3 A3 A2 A2 A2 A1 A1 A1 A3 A3 A3 A3 A3 A3 A3 A3 A3 A3 A3 A3 A3 A3 A3 1418 PANTRY 1504 STORAGE 1503 OFFICE .OS 1408 OPERATIONS OFFICE A3 A3 A1 A1 A1 A1 A1 A1 .OS 1805E GYM STORAGE R A3 B B N1 N1 N1 N1 N1 N1 B A1 A4 B A4 A2 A2 A3 N2 N2 N2 N2 A1 A1 C130 CORRIDOR X1 X1 X1 X1 X1 B B A3 X1 X1 X2 .OS R A4 B B B A2 A1 X1 A1 X1 B F7 K K F7 F7 F7 F7 F7 J3 F7 A2 A2 A2 A3 A3 A3 B A3 A3 X2 X2 A1 A3 R A3 .OS A3 .OS .OS . a/b .OS .OS A4 A4 N1 N1 A2 A2 A1 R R R J3 .OS F1 F1 F1 A3 A1 .OS C C C C C C C C C C C C C C C C C C C X1 X1 X1 X1 X1 X2 X1 X1 .OS .OS X1 X1 X1 X1 X1 X1 H H H H G G G F1 F1 W1 W1 W5 W5 W5 W5 W4 W4 W5 W5 W5 96 ft² PANTRY 1608 PANTRY 1608 OFFICE 1605 CORRIDOR C160 CORRIDOR C161 A2 A3 A3 .OS A3 A3 .OS VESTIBULE V1600 LOCKERS/SHOWER/TOILET 1805H LOCKERS/SHOWER/TOILET 1805F LOCKERS/SHOWER/TOILET 1805G VESTIBULE V1806 LOCKER 1410A FIRE PUMP 1404 B X1 A3 A4 A2 A2 .OS .D .D .D .D HEAD END ROOM 1202 B B SH1-1 SH1-2 SH1-3 SH1-4 SH1-5 SH1-6 EM-1 EM-1 EM-1 EM-2 EM-2 EM-2 EM-2 EM-2 EM-2 EM-2 EM-2 EM-3 EM-3 EM-3 EM-3 EM-3 EM-3 SH1-7 EM-4 EM-4 EM-4 EM-4 EM-4 EM-4 EM-4 EM-4 EM-5 EM-5 EM-5 EM-5 EM-5 EM-5 EM-6 EM-6 EM-6 EM-6 EM-6 EM-6 H1A-1 H1A-3 EM-7 EM-20 A1 A1 A1 A1 J1 J1 J3 J3 J3 J3 J3 J1 J1 J3 J3 J3 J3 J3 J3 J3 J3 J1 J1 J1 . F1 .OS F1 F1 F1 G G G G R R A1 X1 L1 L1 L1 L1 L1 L1 D D D D D D P4 P2 P4 P3 F1 F1 F5 D D D D D D D D D D D D D D D D D D D D D D D D D D D D D D D D D D D D D D D D D D D D D D D D D D D D D D D D H H H H H H SH1-8 H H H Q Q Q Q Q Q Q Q Q Q Q Q Q Q Q Q Q Q Q Q Q A3 SH1-10 L7 EM-3 W5 H1A-9 F1 F1 F1 F1 .D G G G A2 EM-6 a a a a a a b b b b b b B B F7 F7 F7 F7 X1 a a a a a b b b b b c c c c c d d d d d L14 L14 L14 a/b/c/d a/b/c/d a/b/c/d a/b a/b c/d c/d .D F1 L15 X1 X1 .D .D a/b a a a a a a b b b 1301A TOILET .D a/b a a a b b b a a a F7 F7 F7 L16 L16 L17 F7 X1 X1 SH1-20 SH1-20 SH1-21 1500 GYMNASIUM L19 L19 L19 L30 L30 L30 EM-2 EM-5 EM-5 EM-5 EM-5 EM-5 EM-5 EM-6 L21 L21 EM-2 L21 EM-3 EM-3 EM-3 EM-3 EM-4 EM-4 T T T T T T T T T T T T T T T T T T T T EM-5 H1A-2 L22 L22 (TYP) (TYP) L23 L23 .D EM-6 EM-6 a/b a a a a b b EM-5 EM-5 EM-5 .OS EM-4 EM-4 EM-4 EM-4 EM-3 EM-4 EM-4 EM-4 EM-4 EM-4 EM-4 EM-4 EM-4 L34 L32 L32 EM-2 L21 EM-2 L21 EM-6 a a a a a a b b b b b b b b b a c c b .OS a/b a/b a/b c/d c/d c/d b L32 L32 L32 L32 L32 a a a b b b c c c c j j j c c c c j j j j c d d d d i i i d d d d i i i i d j e e e e h h h e e e e h h h e h h g g g g f f f f f f f f g g g g f f e c .D .D SH1-11 .OS B Q AREA B AREA C AREA A N 1 2 3 4 5 6 7 8 9 10 11 12 13 14 15 16 17 18 11720 Beltsville Drive Suite 600 Calverton, MD 20705 Tel: 301.595.1000 1 2 3 4 5 6 7 8 9 10 11 12 13 14 15 16 17 18 A B C D E F G H J K L M A B C D E F G H J K L M © GRIMM AND PARKER, P.C. 2014 © GRIMM AND PARKER, P.C. 2014 www.grimmandparker.com HOLABIRD ACADEMY PK-8 CITY OF BALTIMORE, MARYLAND GP# 21553 KEYPLAN 2429 Members Way Lexington, Ky 40504 Tel: 859.253.0892 http://www.cmtaegrs.com/ EL-1.1 LIGHTING - FIRST FLOOR AREA A 03/13/2017 BID SET TAGGED NOTES L7 THEATRICAL LIGHTING - REFER TO SPECIFICATIONS. L14 PROVIDE WIRE GUARD FOR EXIT LIGHT. L15 CONNECT TO CIRCUIT IN MECHANICAL ROOM ABOVE. L16 PROVIDE 120V CONNECTION TO LIGHTS INTEGRAL TO FREEZER /COOLER.  EXTEND TO SWITCHES / FIXTURES ACCORDINGLY. L17 PROVIDE 120V CONNECTION TO LIGHTS INTEGRAL TO HOOD. EXTEND TO SWITCH / FIXTURES ACCORDINGLY. L19 REFER TO ARCHITECTURAL PLANS FOR EXACT ELEVATION AND MOUNTING LOCATION. L21 EXTERIOR FIXTURE SHALL OPERATE UPON LOSS OF BUILDING POWER AT FULL OUTPUT REGARDLESS OF CONTROLS SEQUENCE. L22 MOUNT FIXTURE TO UNDERSIDE OF CANOPY - REFER TO ARCHITECTURAL DETAIL FOR MOUNTING LOCATION. L23 LOCATE EMERGENCY RELAY IN CEILING OF RECEPTION 10000. EMERGENCY RELAY SHALL OPERATE ALL T TYPE FIXTURES IN ENTIRE ROW UNDER EMERGENCY POWER AT FULL BRIGHTNESS. L30 FIXTURES IN THIS SPACE SHALL BE SUFACE MOUNTED. L32 PROVIDE SWITCH WITH TUNABLE WHITE CONTROLS. L34 ROUTE TO FIXTURES AT SECOND FLOOR ABOVE STAIR REFER TO ENLARGED PLAN SHEET ELL-1.6 FOR CONTINUATION. GENERAL NOTES (LIGHTING): A. REFER TO THE ARCHITECT'S REFLECTED CEILING PLANS, ELEVATIONS, AND CASEWORK DETAILS FOR EXACT LOCATIONS OF ALL WALL AND CEILING MOUNTED ELECTRICAL DEVICES. B. CONTRACTOR SHALL FOLLOW BRANCH CIRCUITING LAY-OUT, AS INDICATED ON THE FLOOR PLANS, WITH A MAXIMUM OF THREE (3) BRANCH CIRCUITS PER HOMERUN.  EACH BRANCH CIRCUIT SHALL BE PROVIDED WITH A DEDICATED NEUTRAL CONDUCTOR.  DEDICATED NEUTRAL CONDUCTORS SHALL BE CONSIDERED CURRENT CARRYING.  IF ADDITIONAL CONDUCTORS ARE RAN IN THE SAME CONDUIT WITH THOSE INDICATED, CONTRACTOR SHALL DERATE ALL CURRENT CARRYING CONDUCTORS PER N.E.C. #310.15(B)(3), AND UPSIZE CONDUIT AS REQUIRED PER N.E.C. #300.17 AND ANNEX C. MULTIWIRE BRANCH CIRCUITS AS DEFINED IN N.E.C #100 / 210.4 (CIRCUITS SHARING A COMMON NEUTRAL CONDUCTOR) SHALL NOT BE PERMITTED. C. LOCATE CHAIN-HUNG INDUSTRIAL FIXTURES IN MECHANICAL ROOMS TO AVOID DUCTWORK AND PIPING, TO MAXIMIZE AVAILABLE LIGHT. SPACE AROUND EQUIPMENT, AIR HANDLERS, ETC. TO PROVIDE ADEQUATE LIGHTING TO ALL AREAS OF ROOM. PROVIDE ADDITIONAL FIXTURES OF SAME TYPE AS NEEDED TO FULFILL THIS REQUIREMENT. D. LOCATE EXIT SIGNS FOR MAXIMUM VIEWING AREA TO IDENTIFY EGRESS PATHS AS INDICATED ON PLANS.  COORDINATE LOCATIONS SUCH THAT ARCHITECTURAL FEATURES OR EQUIPMENT FROM OTHER TRADES DO NOT OBSTRUCT VIEW. E. ALL LIGHTING FIXTURE LENSES, PARABOLIC LOUVERS, DOWNLIGHTING ALZAK CONES AND ""PARACUBE"" LOUVERS SHALL BE HANDLED WITH COTTON GLOVES DURING INSTALLATION TO AVOID FINGERPRINTS OR DIRT DEPOSITS.  AT CLOSE OF PROJECT, AND AFTER CONSTRUCTION AIR FILTERS ARE CHANGED, REMOVE PROTECTIVE PLASTIC. ANY LOUVER OR CONE SHOWING DIRT OR FINGER PRINTS SHALL BE CLEANED WITH SOLVENT RECOMMENDED BY THE MANUFACTURER, OR REPLACED AS NECESSARY IN ORDER TO TURN OVER TO THE OWNER NEW FIXTURES AT OCCUPANCY. F. RECESSED LUMINAIRES SHALL BE SECURED SUCH THAT THE FORCE REQUIRED INSERTING LAMPS, TRIMS, LENSES, LOUVERS, OR DOOR FRAMES DOES NOT SHIFT HOUSING.  ALL TRIMS SHALL BE COMPLETELY FLUSH WITH FINISHED CEILINGS AT COMPLETION OF CONSTRUCTION. G. CONTRACTOR SHALL PROVIDE UNSWITCHED EMERGENCY CONDUCTOR TO ALL EXIT SIGNS, AND NIGHT LIGHTS AS REQUIRED. H. DIMMING CONDUCTORS ARE NOT INDICATED ON DRAWING. CONTRACTOR SHALL PROVIDE ALL DIMMING CONDUCTORS AS REQUIRED FOR FIXTURES INDICATED ON LUMINARE SCHEDULE TO BE DIMMING. I. COORDINATE LIGHT SWITCH LOCATIONS IN ALL CLASSROOMS WITH ARCHITECTURAL INTERIOR ELEVATIONS. J. ROUTE ALL EXTERIOR POLE MOUNTED LIGHTING CIRCUITS, BUILDING MOUNTED LIGHTING CIRCUITS, ETC. THROUGH A LIGHTING RELAY, CONTROLLED THROUGH BUILDING LIGHTING CONTROL SYSTEM. EXTERIOR LIGHTING SHALL BE CONTROLLED VIA PHOTOCELL, TIMECLOCK, OR TIME OF DAY SCHEDULING.  PROVIDE CENTRALLY LOCATED PHOTOCELL, REFER MECHANICAL PENTHOUSE FOR PHOTOCELL LOCATION. K. ALL CONDUIT PENETRATIONS THROUGH RATED WALLS SHALL BE SEALED TO MAINTAIN RATING. REFER TO DRAWING A-0.2 FOR RATED WALL LOCATIONS. L. ALL CONDUIT PENETRATIONS THROUGH WALLS SHALL BE SEALED TO MAINTAIN SOUND TRANSFER RATINGS. REFER TO DRAWINGS A-0.8 AND A-3.20 FOR SOUND TRANSFER RATINGS. M. IN ALL WALLS WITH SOUND ATTENUATION BLANKETS OR AN STC RATING LISTED - SWITCHES SHALL NOT BE LOCATED BACK-TO-BACK; JUNCTION BOXES SHALL BE OFFSET AND SEALED. N. MOUNT DEVICES AND CONDUITS IN ACCORDANCE WITH STRUCTURAL RECOMMENDATIONS. REFER TO DRAWING S-0.0. DATE DESCRIPTION ",Architectural
,Architectural
,Architectural
"LR ER OS LR OS LR ER LR ER OS ER OS ER OS ER OS LR LR LR ER OS ER OS OS LR ER ER LR OS ER ER ER ER LR ER ER ER ER ER OS OS OS OS OS OS ER ER ER ER ER ER OS ER ER ER ER ER LR LR LR LR OS OS OS LR LR LR LR ER LR ER ER ER ER ER ER ER ER H J M P EX1 L N 2 4 EX3 8 7 Q EX2 3 AA M.5 X3 X2 6 T R Q.2 X1 5 1 S M.1 L.6 K EXC EXD 5.8 5.1 K.2 K.3 SMALL REHEARSAL 1705 STORAGE 1704 TOILET 1902A KINDERGARTEN 1911 KINDERGARTEN 1910 KINDERGARTEN 1908 RESOURCE 1906 SPECIAL EDUCATION PK-2 1902 PLANNING 1900 PRE-K 1909 STAIR 3 ST31 PRE-K 1907 SUPPLY STORAGE/IT ADMIN 1722A TECH ED LAB 1722 PRE-K 1905 A5 A5 A5 A5 A5 A5 A5 A5 A5 A5 A2 A2 A2 A2 A2 A2 A2 A2 A2 A2 A2 A2 A2 A2 A2 A2 A2 A2 A2 A2 A2 A2 A2 A2 A2 A2 A2 A2 A2 A2 A2 A2 A2 A2 A2 A2 A2 A2 A2 A2 A2 A2 A2 A2 A2 A2 A2 A2 A2 A2 A2 A2 A2 A2 A2 A2 A2 A2 A2 A2 A2 A2 A2 A2 A2 A2 A2 A2 A2 A2 A2 A2 STAFF TOILET 1900A .OS G G G G G G G G G G G A3 A3 A3 A3 1400 LOCKERS/SHOWER/ TOILET 1402 WATER SERVICE 1407 ELECTRICAL C140 CORRIDOR .OS 1904 STORAGE .OS .OS .OS .OS C172 CORRIDOR A1 A1 A1 A1 A1 A1 C171 CORRIDOR .OS .OS .OS C130 CORRIDOR X1 K K A3 B A3 A3 A2 A2 F7 F7 F7 X1 X1 X1 G X1 A3 A3 A3 A3 .OS A2 A2 A2 .OS .OS F7 F7 X1 X1 F7 F7 A2 A2 F7 C190 CORRIDOR .OS .OS a a a a a/b a a a a b b b b b b .D a/b b b .D a/b a a a a b b b b b b b b .D a/b a a a a b b b b b b b b a a a a b b b b b b b b .D a/b .D a/b a a a a b b b b b b b b A2 A2 A2 A2 A2 A2 A2 A2 A2 A2 A2 A2 .D a/b a a a a b b b b b b b b .D a/b a a a a b b b b b b a/b .D a a a a b b b b b b b b . a/b . a/b 1905A PK-2 TOILET 1903A MECH .OS A2 B .OS .OS X1 X1 F2 F2 F2 F2 A3 X1 X1 X1 X1 X1 X1 X1 A3 W5 W5 W5 W5 W5 W5 W5 W1 FIRE PUMP 1404 B SH1-5 EM-2 EM-9 EM-9 H1B-5 H1B-6 EM-11 EM-11 EM-11 EM-11 EM-11 EM-11 EM-11 EM-11 EM-11 EM-12 EM-12 EM-12 EM-12 EM-12 EM-12 EM-12 EM-12 H1B-7 EM-13 EM-13 EM-13 EM-13 EM-13 EM-13 EM-13 EM-13 EM-20 EM-20 G G F4 G G G A1 H1B-9 L1 L1 L1 L1 L1 L1 L1 L1 L1 L1 L1 L1 L1 L1 L1 L1 L1 L1 L1 L1 L1 L1 L1 L1 L1 L1 L1 L1 L1 L1 L1 L1 L4 L4 L4 L4 L4 L4 L2 L1 L1 L1 L2 L1 L1 L1 L2 L1 L1 L1 L2 L1 L1 L1 L2 L1 L1 L1 L2 L1 L1 L1 G G G G G C172 CORRIDOR G F1 F1 G G EM-9 A2 H1B-1 M M EM-12 EM-12 L6 H1A-8 H1A-7 H1A-6 EM-12 EM-13 EM-13 W5 a a a a a b b b b b a a a a a a b b b b b b b b b b b b b b b b b 1920 COLLABORATIVE LEARNING L18 L18 L18 L18 L18 L18 X1 L6 L6 L19 L19 L30 EM-2 W1 EM-13 L21 L21 .D a/b L31 .OS . .D .D .D EM-2 L21 a/b/c/d/e a a b c c c d d L12 W6 L11 b b b b b b b b b b b b a a a a a a a a a a a a .D a/b L31 L32 L1 L1 L1 L1 L1 L1 L25 L25 L25 L25 L25 L25 AREA B AREA C AREA A N 1 2 3 4 5 6 7 8 9 10 11 12 13 14 15 16 17 18 11720 Beltsville Drive Suite 600 Calverton, MD 20705 Tel: 301.595.1000 1 2 3 4 5 6 7 8 9 10 11 12 13 14 15 16 17 18 A B C D E F G H J K L M A B C D E F G H J K L M © GRIMM AND PARKER, P.C. 2014 © GRIMM AND PARKER, P.C. 2014 www.grimmandparker.com HOLABIRD ACADEMY PK-8 CITY OF BALTIMORE, MARYLAND GP# 21553 KEYPLAN 2429 Members Way Lexington, Ky 40504 Tel: 859.253.0892 http://www.cmtaegrs.com/ EL-1.3 LIGHTING - FIRST FLOOR AREA C 03/13/2017 BID SET 4' 8' 32' 16' 0 1/8"" = 1'-0"" 24' 2' SCALE:  1/8"" = 1'-0"" First Floor - Lighting - Area C 1 TAGGED NOTES L6 CONTINUE TO LIGHTING CIRCUIT ABOVE. L11 PROVIDE LIGHT IN CHASE ABOVE WINDOW.  CONNECT TO NORMAL LIGHTING CIRCUIT IN CORRIDOR SPACE WITH 2#12, 1#12 GROUND IN 3/4"" CONDUIT.  PROVIDE PUSHBUTTON TIMER SWITCH SET TO 15 MINUTES ON CHASE WALL IN CORRIDOR FOR CONTROL OF FIXTURE. L12 PROVIDE ELEVATOR LIGHTS LOCATED 12"" BELOW FINISHED FIRST FLOOR.   CONNECT CIRCUIT TO LINE SIDE OF GFI RECEPTACLES IN THIS SPACE.  EXTEND CIRCUIT TO TOP OF SHAFT.  PROVIDE LIGHT SWITCH IN BOTTOM OF SHAFT FOR CONTROL OF LIGHTS IN BOTTOM. L18 CORD REEL LOCATION - REFER TO E-2.3. L19 REFER TO ARCHITECTURAL PLANS FOR EXACT ELEVATION AND MOUNTING LOCATION. L21 EXTERIOR FIXTURE SHALL OPERATE UPON LOSS OF BUILDING POWER AT FULL OUTPUT REGARDLESS OF CONTROLS SEQUENCE. L25 UTILIZE FIRE RATED JUNCTION BOXES FOR INSTALLATION OF LIGHT FIXTURES. ALL CONDUIT, CONDUCTORS, ETC. SHALL BE ROUTED CONCEALED. MAINTAIN FIRE RATING OF CEILING. L30 FIXTURES IN THIS SPACE SHALL BE SUFACE MOUNTED. L31 DIM FIXTURES IN THIS AREA AS INDEPENDENT ZONE. L32 PROVIDE SWITCH WITH TUNABLE WHITE CONTROLS. GENERAL NOTES (LIGHTING): A. REFER TO THE ARCHITECT'S REFLECTED CEILING PLANS, ELEVATIONS, AND CASEWORK DETAILS FOR EXACT LOCATIONS OF ALL WALL AND CEILING MOUNTED ELECTRICAL DEVICES. B. CONTRACTOR SHALL FOLLOW BRANCH CIRCUITING LAY-OUT, AS INDICATED ON THE FLOOR PLANS, WITH A MAXIMUM OF THREE (3) BRANCH CIRCUITS PER HOMERUN.  EACH BRANCH CIRCUIT SHALL BE PROVIDED WITH A DEDICATED NEUTRAL CONDUCTOR.  DEDICATED NEUTRAL CONDUCTORS SHALL BE CONSIDERED CURRENT CARRYING.  IF ADDITIONAL CONDUCTORS ARE RAN IN THE SAME CONDUIT WITH THOSE INDICATED, CONTRACTOR SHALL DERATE ALL CURRENT CARRYING CONDUCTORS PER N.E.C. #310.15(B)(3), AND UPSIZE CONDUIT AS REQUIRED PER N.E.C. #300.17 AND ANNEX C. MULTIWIRE BRANCH CIRCUITS AS DEFINED IN N.E.C #100 / 210.4 (CIRCUITS SHARING A COMMON NEUTRAL CONDUCTOR) SHALL NOT BE PERMITTED. C. LOCATE CHAIN-HUNG INDUSTRIAL FIXTURES IN MECHANICAL ROOMS TO AVOID DUCTWORK AND PIPING, TO MAXIMIZE AVAILABLE LIGHT. SPACE AROUND EQUIPMENT, AIR HANDLERS, ETC. TO PROVIDE ADEQUATE LIGHTING TO ALL AREAS OF ROOM. PROVIDE ADDITIONAL FIXTURES OF SAME TYPE AS NEEDED TO FULFILL THIS REQUIREMENT. D. LOCATE EXIT SIGNS FOR MAXIMUM VIEWING AREA TO IDENTIFY EGRESS PATHS AS INDICATED ON PLANS.  COORDINATE LOCATIONS SUCH THAT ARCHITECTURAL FEATURES OR EQUIPMENT FROM OTHER TRADES DO NOT OBSTRUCT VIEW. E. ALL LIGHTING FIXTURE LENSES, PARABOLIC LOUVERS, DOWNLIGHTING ALZAK CONES AND ""PARACUBE"" LOUVERS SHALL BE HANDLED WITH COTTON GLOVES DURING INSTALLATION TO AVOID FINGERPRINTS OR DIRT DEPOSITS.  AT CLOSE OF PROJECT, AND AFTER CONSTRUCTION AIR FILTERS ARE CHANGED, REMOVE PROTECTIVE PLASTIC. ANY LOUVER OR CONE SHOWING DIRT OR FINGER PRINTS SHALL BE CLEANED WITH SOLVENT RECOMMENDED BY THE MANUFACTURER, OR REPLACED AS NECESSARY IN ORDER TO TURN OVER TO THE OWNER NEW FIXTURES AT OCCUPANCY. F. RECESSED LUMINAIRES SHALL BE SECURED SUCH THAT THE FORCE REQUIRED INSERTING LAMPS, TRIMS, LENSES, LOUVERS, OR DOOR FRAMES DOES NOT SHIFT HOUSING.  ALL TRIMS SHALL BE COMPLETELY FLUSH WITH FINISHED CEILINGS AT COMPLETION OF CONSTRUCTION. G. CONTRACTOR SHALL PROVIDE UNSWITCHED EMERGENCY CONDUCTOR TO ALL EXIT SIGNS, AND NIGHT LIGHTS AS REQUIRED. H. DIMMING CONDUCTORS ARE NOT INDICATED ON DRAWING. CONTRACTOR SHALL PROVIDE ALL DIMMING CONDUCTORS AS REQUIRED FOR FIXTURES INDICATED ON LUMINARE SCHEDULE TO BE DIMMING. I. COORDINATE LIGHT SWITCH LOCATIONS IN ALL CLASSROOMS WITH ARCHITECTURAL INTERIOR ELEVATIONS. J. ROUTE ALL EXTERIOR POLE MOUNTED LIGHTING CIRCUITS, BUILDING MOUNTED LIGHTING CIRCUITS, ETC. THROUGH A LIGHTING RELAY, CONTROLLED THROUGH BUILDING LIGHTING CONTROL SYSTEM. EXTERIOR LIGHTING SHALL BE CONTROLLED VIA PHOTOCELL, TIMECLOCK, OR TIME OF DAY SCHEDULING.  PROVIDE CENTRALLY LOCATED PHOTOCELL, REFER MECHANICAL PENTHOUSE FOR PHOTOCELL LOCATION. K. ALL CONDUIT PENETRATIONS THROUGH RATED WALLS SHALL BE SEALED TO MAINTAIN RATING. REFER TO DRAWING A-0.2 FOR RATED WALL LOCATIONS. L. ALL CONDUIT PENETRATIONS THROUGH WALLS SHALL BE SEALED TO MAINTAIN SOUND TRANSFER RATINGS. REFER TO DRAWINGS A-0.8 AND A-3.20 FOR SOUND TRANSFER RATINGS. M. IN ALL WALLS WITH SOUND ATTENUATION BLANKETS OR AN STC RATING LISTED - SWITCHES SHALL NOT BE LOCATED BACK-TO-BACK; JUNCTION BOXES SHALL BE OFFSET AND SEALED. N. MOUNT DEVICES AND CONDUITS IN ACCORDANCE WITH STRUCTURAL RECOMMENDATIONS. REFER TO DRAWING S-0.0. DATE DESCRIPTION ",Architectural
