text,label
"DN UP DN 4"" FD H J M P EX1 L N 2 4 EX3 G.9 7 Q EX2 3 AA M.5 X3 X2 6 T R Q.2 EE X1 5 1 S M.1 L.6 K EXC EXD 5.8 5.1 K.2 K.3 GRADE 8 2312 MECH 2310 GRADE 8 2308 GRADE 6 2306 STORAGE 2302A STAFF TOILET 2302B PLANNING 2302 FLEX 2300 WOMEN 2301 MEN 2303 MECH 2100 SPECIAL EDUCATION 6-8 2304 GRADE 6 2307 GRADE 7 2309 MECH 2311 GRADE 7 2313 COLLABORATIVE LEARNING 2320 RESOURCE 2305 P-4.1 4 STAIR 1 ST12 STAIR 3 ST32 CORRIDOR C210 2"" SAN 4"" FD 2"" SAN 1 1/2"" V 2"" SAN 1 1/2"" V 1 1/2"" V 2"" SAN F-6B F-6B F-6B F-6B F-6B F-6B F-6B F-1A F-2A F-6 F-6 3"" SAN 1 1/2"" V 4"" SAN 4"" SAN 1 1/2"" V S 5.1 V 5 S 7 V 7 S 8 V 8 S 9 V 9 6"" EST 6"" ST UP TO RD-25 6"" EST 6"" ST UP TO ERD-25 4"" EST 6"" ST 4"" EST 3"" ST ST 5 EST 5 UP TO RD-24 UP TO ERD-24 UP TO ERD-33 CO UP TO RD-33 4"" EST 4"" ST 4"" ST 4"" ST 8"" EST UP TO ERD-34 UP TO RD-34 6"" EST 4"" ST 6"" ST UP TO ERD-35 UP TO RD-35 4"" ST CO ST 11 CO UP TO RD-36 UP TO ERD-36 6"" ST 4"" EST CO 8"" EST 8"" EST UP TO RD-37 8"" ST 8"" EST 4"" EST UP TO ERD-37 ST 10 6"" EST 6"" ST 6"" EST 6"" ST UP TO RD-38 UP TO ERD-38 6"" ST 4"" EST CO UP TO RD-39 UP TO ERD-39 EST 8 EST 9 8"" ST F-6 1 1/2"" V 1 1/2"" V 8"" ST PIPE RUNNING IN FIRST FLOOR CEILING PIPE RUNNING IN FIRST FLOORCEILING SEE DRAWING 1/P1.4 FOR CONTINUATION 1 P1.4 SEE DRAWING 1/P1.4 FOR CONTINUATION 1 P1.4 F-7 2"" SAN 1 1/2"" V PIPE RUNNING IN FIRST FLOOR CEILING CORRIDOR C230 W 23 W 24 W 25 W 26 W 29 W 28 W 30 W 31 W 32 4"" FD 4"" FD 4"" FD S 10 V 16 V 16.1 4"" SAN 4"" SAN 3/4"" CW DN 2"" SAN 4"" SAN 6"" ST 3/4"" CW HVAC WATER FILL LINE 8 P-7.2 KEY PLAN 1. PROVIDE TRAP PRIMING TO ALL FLOOR DRAINS, FLOOR SINKS AND OPEN SITE DRAINS. 2. PROVIDE ACCESS PANELS TO ALL DOMESTIC SUPPLY VALVES. 3. PROVIDE ACCESS PANELS TO ALL WATER HAMMER ARERESTORS. REFER TO PLUMBING RISER DIAGRAM FOR WATER HAMMER ARRESTOR LOCATION. SHEET KEY NOTES # 1 2 3 4 5 6 7 8 9 10 11 12 13 14 15 16 17 18 11720 Beltsville Drive Suite 600 Calverton, MD 20705 Tel: 301.595.1000 1 2 3 4 5 6 7 8 9 10 11 12 13 14 15 16 17 18 A B C D E F G H J K L M A B C D E F G H J K L M © GRIMM AND PARKER, P.C. 2014 © GRIMM AND PARKER, P.C. 2014 www.grimmandparker.com HOLABIRD ACADEMY PK-8 CITY OF BALTIMORE, MARYLAND GP# 21553 M/E/P/FP DESIGN ENGINEERING • PROJECT MANAGEMENT ENERGY MANAGEMENT SERVICES • DESIGN-BUILD SERVICES CONSTRUCTION MANAGEMENT • COMMISSIONING DISTRICT OF COLUMBIA • MARYLAND NEW YORK • VIRGINIA www.SETTY.com PROJECT NUMBER: TM ONE SOUTH STREET, SUITE 1130 BALTIMORE, MARYLAND 21202 TEL: 667-309-6036 P-1.6 PLUMBING PARTIAL SECOND FLOOR PLAN – AREA C 03/13/2017 BID SET SAXXYY###.## SCALE:  1/8"" = 1'-0"" P-1.6 1 PLUMBING PARTIAL SECOND FLOOR PLAN – AREA C AREA B AREA C AREA A DATE DESCRIPTION ",Plumbing
,Plumbing
,Plumbing
"SCALE: SCALE: SCALE: SCALE: SCALE: SCALE: A A SCALE: SCALE: UP TO 6' UP TO 20' OVER 20' JUNCTION BOX 4 2 3 2 TRAP PRIMER VALVE DISTRIBUTION UNIT, FOR 5 LINES 1/2"" TRAP PRIMER LINE FLOOR SLAB FLOOR DRAIN SLEEVE THROUGH SLAB ADDITIONAL ARRESTER MAIN MAIN MAIN BRANCH BRANCH WHA WHA WHA WHA AQUASTAT ON @115°F OFF @ 120°F AQUASTAT ON @135°F OFF @ 140°F TMV ASSE 1017 SET AT 120°F A.S.M.E. COMBINATION TEMPERATURE AND PRESSURE RELIEF VALVE DRAIN VALVE DRAIN PIPE 2 1/2"" HW FROM WATER TO WATER HEAT PUMP. SEE MECHANICAL DRAWINGS FOR CONTINUATION. DRAIN PIPE DRAIN VALVE A.S.M.E. COMBINATION TEMPERATURE AND PRESSURE RELIEF VALVE DRAIN VALVE DRAIN PIPE 2 1/2"" 2 1/2"" 2 1/2"" NATURAL GAS CONNECTION REFER TO MECHANICAL DRAWINGS FOR MORE DETAILS NOTES: THE PRIMING VALVE IS AUTOMATICALLY ACTIVATED WHEN IT SENSES A PRESSURE DROP OF 5 TO 10 P.S.I.G. THE TRAP PRIMER MUST BE INSTALLED ON COLD WATER LINES OF 1 1/2"" DIAMETER OR LESS. PROBE OFF HIGH LEVEL FLOAT PUMP ON FLOAT 5 7 2 1 4 MULTI-PIN CONNECTOR COVER MIN. PIT SIZE 24""x24""x24"" GATE VALVE FLOOR MULTI-PIN CONNECTOR & CORD IN CONDUIT LENGTHS AS REQUIRED, 25FT. STANDARD, 25FT FT. INCREMENTS POWER SUPPLY ELECTRIC OUTLET NIPC ALL INSTALLATIONS SHALL BE AS DIRECTED BY MANUFACTURER WC WC LAV LAV WC WC WC WC WC WC WC WC WC NOTE: 1. WATER HAMMER ARRESTERS SHALL BE INSTALLED ON ALL BRANCH PIPING SERVING PLUMBING FIXTURES, QUICK-CLOSING VALVES, EQUIPMENT, OR WALL HYDRANTS/HOSE BIBS. 2. BRANCH PIPES WITH A DEVELOPED LENGTH OF 25' OR LESS MAY HAVE ARRESTERS REDUCED BY ONE SIZE. 3. BRANCH PIPES WITH A DEVELOPED LENGTH OF 75' OR GREATER MAY HAVE ARRESTERS REDUCED BY ONE SIZE. 4. STOP VALVE AND WATER HAMMER ARRESTERS SHALL BE ACCESSIBLE THROUGH A SINGLE ACCESS DOOR. 5. SEE FLOOR PLANS/RISER DIAGRAMS FOR CONTINUATION. 6. WHEN WORKING WATER PRESSURE EXCEEDS 65 PSI USE NEXT LARGEST SIZE. 7. MAXIMUM PIPING LENGTH COVERED BY ONE ARRESTER SHALL BE 20 LINEAR FEET. PROBE OFF STAINLESS STEEL INLET & OUTLET BAFFLES 4""- 6"" OUTLET GASKET 4""- 6"" INLET GASKET HYDRAULIC LINE 24"" DIA OPENING 24"" DIA OPENING PLAN VIEW SECTION VIEW 4' 0"" 5' 5"" 4' 3"" 3' 8"" 9"" 8"" 3"" 8"" 5' 3"" 8' 10"" INSTALLATION DETAIL COLLAR HEIGHT TRIMMABLE ON SITE. FOR TRAFFIC LOADING CONDITIONS REINFORCED CONCRETE RELIEVING SLAB EXTENSION COLLAR AS REQUIRED ∅ 24"" FRAME AND COVER (2). SECURED IN CONCRETE CAST IN PLACE ANTI BOUYANCY SLAB FOR HIGH WATER TABLE CONDITIONS 3000 psi CONCRETE READY MIX POUR 12 INCHES AROUND BASE OF UNIT  (58 CU FT MINIMUM BASED ON CONCRETE DENSITY OF 130 LBS/CU FT DENSITY 4"" INLET 4"" OUTLET DETAIL ""A"" DETAIL A WATERTIGHT SEAL WITH SIKAFLEX CAULK 1"" GAP CAST IRON FRAME SUSPENDED IN SLAB, AND CENTRED OVER COLLAR 4' 3"" MIN 18"" MIN. 6""  PEA GRAVEL (OR APPROVED BACKFILL COMPACTED TO 98% SPD) 4' 0"" PEA GRAVEL (OR APPROVED EQUIVALENT COMPACTED TO 98% SPD) 2"" NPT FITTING FOR VENT 2"" VENT FROM FLOW CONTROL DEVICE FLOW CONTROL DEVICE 1    MYERS MODEL ME-45MC-11 SUBMERSIBLE EFFLUENT       PUMP 0.5 HP, 115 VOLT, 3450 RPM, 2"" DISCHARGE CONNECTION 2    MYERS CHECK VALVE 3    NOT USED. 4   JUNCTION BOX WILL BE PROVIDED WITH MULTI-PIN CONNECTOR      AND CORD IN LENGTHS AS REQUIRED; 25 FT. IS STANDARD,      OPTIONAL 25 FT. INCREMENTS AVAILABLE. 5   ALL BURIED PUMP PRESSURE DISCHARGE PIPING SHALL BE      PROTECTED WITH TAPECOAT CT CORROSION PROTECTION      TAPE. 6   NOT USED 7   HIGH LIQUID ALARM FLOAT WITH CLAMP DEVICE TO MOUNT TO      PUMP DISCHARGE PIPING (16' LONG). GAS METER BY  GAS COMPANY COORDINATE W/ GAS COMPANY FOR CONCRETE PAD SIZE FINISHED GRADE TO BUILDING SUPPLY PLUG VALVE (BY PLUMBING CONTRACTOR) TEE W/BUSHING GAS PRESSURE REGULATOR BY GAS COMPANY INSULATING UNION BY GAS COMPANY PLUGGED TEE W/BUSHING AND 10 PLUG BY GAS COMPANY PLUG VALVE BY GAS COMPANYMAGNETIC WARNING AND  IDENTIFICATION TAPE BY GAS COMPANY POLYETHYLENE PIPING BY GAS COMPANY ANODE-LESS RISER BY GAS COMPANY T T ET-1 SEE WATER HEATER SCHEDULE FOR DETAILS 140° HW 120° HW 120° HWR 140° HWR 140° HW CW CW NC FRONT VIEW IN TOP VIEW PURIFIER PRE-FILTER IN OUT OUT 3"" X 2"" CHANNEL SKIDS 2"" 2"" 80"" 2"" 9-1/2"" OPTIONAL CABINET 48"" 61"" 66"" NC NO CW PP 2 PP 1 ET 1 DWH 2 DWH 1 WH 1 DWHP 1 PRIMER TRAP DETAIL NOT TO SCALE 1 P-7.2 ELEVATOR OIL-MINDER SYSTEM DETAIL NOT TO SCALE 5 P-7.2 WATER HAMMER ARRESTER DETAIL NOT TO SCALE 3 P-7.2 1000 GALLON GREASE INTERCEPTOR DETAIL NOT TO SCALE 4 P-7.2 GAS SERVICE DETAIL NOT TO SCALE 6 P-7.2 DOMESTIC WATER HEATER DETAIL NOT TO SCALE 2 P-7.2 FILTRATION SYSTEM DETAIL NOT TO SCALE 7 P-7.2 G G G PLUMBING CONTRACTOR MECHANICAL CONTRACTOR 3/4"" 3/4"" 3/4"" WATER HAMMER ARRESTER NORMALLY CLOSED FULL SIZE BY-PASS VALVE 3/4"" FLOW METER PRV SET @ 15 PSI DDC PRESSURE SENSOR TO GEOTHERMAL SYSTEM 2-WAY, 2-POSITION VALVE 3/4"" DRAIN HVAC FILL SYSTEM PIPING SCHEMATIC DETAIL NOT TO SCALE 8 P-7.2 P F P P 1 2 3 4 5 6 7 8 9 10 11 12 13 14 15 16 17 18 11720 Beltsville Drive Suite 600 Calverton, MD 20705 Tel: 301.595.1000 1 2 3 4 5 6 7 8 9 10 11 12 13 14 15 16 17 18 A B C D E F G H J K L M A B C D E F G H J K L M © GRIMM AND PARKER, P.C. 2014 © GRIMM AND PARKER, P.C. 2014 www.grimmandparker.com HOLABIRD ACADEMY PK-8 CITY OF BALTIMORE, MARYLAND GP# 21553 M/E/P/FP DESIGN ENGINEERING • PROJECT MANAGEMENT ENERGY MANAGEMENT SERVICES • DESIGN-BUILD SERVICES CONSTRUCTION MANAGEMENT • COMMISSIONING DISTRICT OF COLUMBIA • MARYLAND NEW YORK • VIRGINIA www.SETTY.com PROJECT NUMBER: TM ONE SOUTH STREET, SUITE 1130 BALTIMORE, MARYLAND 21202 TEL: 667-309-6036 P-7.2 PLUMBING DETAILS 03/13/2017 BID SET SAXXYY###.## DATE DESCRIPTION ",Plumbing
"J.4 4"" FD 4"" FD D E H EX1 2 4 EX3 8 F G.9 7 EX2 3 BB CC DD X3 X2 6 A B C G EE X1 5 1 EXA EXB 5.8 5.1 D.7 G.7 FLEX 2200 STORAGE 2204B STAFF TOILET 2204A PLANNING 2204 SPECIAL EDUCATION 3-5 2206 GRADE 5 2210 GRADE 5 2214 MECH 2212 COLLABORATIVE LEARNING 2220 GRADE 4 2215 MECH 2213 GRADE 4 2211 FLEX 2209 SCIENCE LAB 2000 MECH/UTILITY 2205 RESOURCE 2208 PREP/STORAGE 2000A P-4.1 5 PIPE RUNNING IN FIRST FLOOR CEILING MEN 2203 WOMEN 2201 4"" SAN 2"" V 4"" SAN 3"" SAN 4"" SAN F-6 F-6 F-6 F-6 F-6B F-6B F-6B F-6B F-6B F-6B F-1A F-2A F-6B F-6B ELEVATOR E1 3"" SAN 2"" SAN 2"" V 4"" SAN 4"" SAN 2"" SAN 4"" SAN 2"" SAN 1 1/2"" V S 1 V 1 S 2 V 2 4"" SAN S 3 V 3 S 4 V 4 V 12 6"" ST UP TO RD-26 CO 4"" ST UP TO RD-27 8"" ST 6"" ST UP TO RD-28 8"" ST CO 8"" ST ST 7 ST 8 8"" ST CO 4"" ST UP TO RD-32 UP TO RD-31 4"" ST 6"" ST 6"" ST 6"" ST UP TO RD-30 4"" ST CO 4"" ST UP TO RD-29 EST 6 EST 7 CO 8"" EST UP TO ERD-28 8"" EST UP TO ERD-27 6"" EST UP TO ERD-26 UP TO ERD-32 CO 8"" EST 6"" EST UP TO ERD-31 6"" EST 6"" EST UP TO ERD-30 4"" EST UP TO ERD-29 F-8 F-6 AAV 1 1/2"" V 2"" SAN 2"" V 2"" V 2 PIPE RUNNING IN FIRST FLOOR CEILING PIPE RUNNING IN FIRST FLOOR CEILING F-7 2"" SAN CORRIDOR C220 REF W 6 W 7 W 9 W 8 W 13 W 14 W 15 W 16 W 17 W 19 W 20 W 21 4"" FD W 35 2"" SAN 2"" SAN 1 1/2"" V 1 1/2"" V 4"" EST 4"" EST 6"" EST KEY PLAN 1. PROVIDE TRAP PRIMING TO ALL FLOOR DRAINS, FLOOR SINKS AND OPEN SITE DRAINS. 2. SEE AREA B ROOF PLAN FOR ROOF DRAIN DETAILS. 3. PROVIDE ACCESS PANELS TO ALL DOMESTIC SUPPLY VALVES. 4. PROVIDE ACCESS PANELS TO ALL WATER HAMMER ARERESTORS. REFER TO PLUMBING RISER DIAGRAM FOR WATER HAMMER ARRESTOR LOCATION. SHEET KEY NOTES # 1 2 3 4 5 6 7 8 9 10 11 12 13 14 15 16 17 18 11720 Beltsville Drive Suite 600 Calverton, MD 20705 Tel: 301.595.1000 1 2 3 4 5 6 7 8 9 10 11 12 13 14 15 16 17 18 A B C D E F G H J K L M A B C D E F G H J K L M © GRIMM AND PARKER, P.C. 2014 © GRIMM AND PARKER, P.C. 2014 www.grimmandparker.com HOLABIRD ACADEMY PK-8 CITY OF BALTIMORE, MARYLAND GP# 21553 M/E/P/FP DESIGN ENGINEERING • PROJECT MANAGEMENT ENERGY MANAGEMENT SERVICES • DESIGN-BUILD SERVICES CONSTRUCTION MANAGEMENT • COMMISSIONING DISTRICT OF COLUMBIA • MARYLAND NEW YORK • VIRGINIA www.SETTY.com PROJECT NUMBER: TM ONE SOUTH STREET, SUITE 1130 BALTIMORE, MARYLAND 21202 TEL: 667-309-6036 P-1.5 PLUMBING PARTIAL SECOND FLOOR PLAN – AREA B 03/13/2017 BID SET SAXXYY###.## SCALE:  1/8"" = 1'-0"" P-1.5 1 PLUMBING PARTIAL SECOND FLOOR PLAN – AREA B AREA B AREA C AREA A DATE DESCRIPTION ",Plumbing
"KEY PLAN H H J J 11 11 L N N 8 8 A3 12 F 10 10 Q Q AA DD 13 13 EE A1 A2 A4 A5 M.1 M.1 9 9 K K 11.4 EX4 EX4 EXB EXB EXC EXC G.2 4"" VTR V 11 975 SF 4"" VTR V 13 1 1 2 3"" VTR V 14 DS 975 SF 2 DS 3"" VTR V 15 1 ERD-12 RD-12 1110 SF ERD-16 RD-16 850 SF ERD-19 RD-19 871 SF ERD-13 1317 SF RD-13 ERD-17 1575 SF RD-17 ERD-20 988 SF RD-20 ERD-21 701 SF RD-21 ERD-22 RD-22 1499 SF ERD-10 RD-10 1378 SF ERD-14 RD-14 1398 SF ERD-7 RD-7 1696 SF ERD-5 RD-5 1568 SF ERD-6 RD-6 1598 SF ERD-8 RD-8 1525 SF ERD-9 RD-9 1565 SF ERD-1 RD-1 778 SF ERD-2 RD-2 737 SF RD-3 745 SF ERD-4 RD-4 773 SF ERD-11 RD-11 1398 SF ERD-15 RD-15 1806 SF ERD-18 RD-18 1875 SF ERD-23 RD-23 1877 SF 1. OFFSET SANITARY VENT IN CEILING SPACE BELOW IF NECESSARY AND PROVIDE MIN 10'-0"" CLEARANCE FROM ANY MECHANICAL EQUIPMENT AND FRESH AIR INTAKE. 2. DOWNSPOUT TO BOOT AT GRADE FROM CANOPY GUTTER. REFER TO ARCHITECTURAL DRAWINGS FOR MORE DETAILS. SHEET KEY NOTES # 1 2 3 4 5 6 7 8 9 10 11 12 13 14 15 16 17 18 11720 Beltsville Drive Suite 600 Calverton, MD 20705 Tel: 301.595.1000 1 2 3 4 5 6 7 8 9 10 11 12 13 14 15 16 17 18 A B C D E F G H J K L M A B C D E F G H J K L M © GRIMM AND PARKER, P.C. 2014 © GRIMM AND PARKER, P.C. 2014 www.grimmandparker.com HOLABIRD ACADEMY PK-8 CITY OF BALTIMORE, MARYLAND GP# 21553 M/E/P/FP DESIGN ENGINEERING • PROJECT MANAGEMENT ENERGY MANAGEMENT SERVICES • DESIGN-BUILD SERVICES CONSTRUCTION MANAGEMENT • COMMISSIONING DISTRICT OF COLUMBIA • MARYLAND NEW YORK • VIRGINIA www.SETTY.com PROJECT NUMBER: TM ONE SOUTH STREET, SUITE 1130 BALTIMORE, MARYLAND 21202 TEL: 667-309-6036 P-1.7H PLUMBING PARTIAL ROOF PLAN - AREA A 03/13/2017 BID SET SAXXYY###.## AREA B AREA C AREA A SCALE:  1/8"" = 1'-0"" P-1.7H 1 PLUMBING PARTIAL ROOF PLAN – AREA A DATE DESCRIPTION ",Plumbing
,Plumbing
,Plumbing
"J.4 D D E H H EX1 EX1 2 2 4 4 EX3 EX3 F 7 7 EX2 EX2 3 3 BB DD X3 X2 6 6 A A B B C C G EE X1 5 5 1 1 EXA EXA EXB EXB 5.8 5.8 RD-26 ERD-26 2880 SF RD-27 ERD-27 1777 SF RD-28 ERD-28 2190 SF RD-29 ERD-29 1717 SF RD-30 ERD-30 2140 SF RD-31 ERD-31 1447 SF RD-32 ERD-32 2281 SF V 12 3"" VTR V 10 4"" VTR V 2 3"" VTR 3"" VTR V 1 3"" VTR V 3 V 4 3"" VTR 2 1 1 1 1 1 1 ERD(G)-1 1084 SF RD(G)-1 ERD(G)-2 1423 SF RD(G)-2 RH 3 4 KEY PLAN 1. OFFSET SANITARY VENT IN CEILING SPACE BELOW IF NECESSARY AND PROVIDE MIN 10'-0"" CLEARANCE FROM ANY MECHANICAL EQUIPMENT AND FRESH AIR INTAKE. 2. SCUPPER TO METAL COLLECTOR BOX AND DOWNSPOUT AND BOOT AT GRADE BY OTHERS (TYPICAL). 3. REMOVE ROOF HYDRANT AFTER GREEN ROOF IS ESTABLISHED AND IN PERIOD NO LONGET THAN 2 YEARS. REMOVE ROOF HYDRANT & DRAIN LINE AND SEAL ELEVATION AND ROOF PENETRATION. 4. USE 100 FEET OF 3/4"" HOSE TO ESTABLISH (WATERING) THE GREEN ROOF. SHEET KEY NOTES # 1 2 3 4 5 6 7 8 9 10 11 12 13 14 15 16 17 18 11720 Beltsville Drive Suite 600 Calverton, MD 20705 Tel: 301.595.1000 1 2 3 4 5 6 7 8 9 10 11 12 13 14 15 16 17 18 A B C D E F G H J K L M A B C D E F G H J K L M © GRIMM AND PARKER, P.C. 2014 © GRIMM AND PARKER, P.C. 2014 www.grimmandparker.com HOLABIRD ACADEMY PK-8 CITY OF BALTIMORE, MARYLAND GP# 21553 M/E/P/FP DESIGN ENGINEERING • PROJECT MANAGEMENT ENERGY MANAGEMENT SERVICES • DESIGN-BUILD SERVICES CONSTRUCTION MANAGEMENT • COMMISSIONING DISTRICT OF COLUMBIA • MARYLAND NEW YORK • VIRGINIA www.SETTY.com PROJECT NUMBER: TM ONE SOUTH STREET, SUITE 1130 BALTIMORE, MARYLAND 21202 TEL: 667-309-6036 P-1.8 PLUMBING PARTIAL ROOF PLAN – AREA B 03/13/2017 BID SET SAXXYY###.## SCALE:  1/8"" = 1'-0"" P-1.8 1 PLUMBING PARTIAL ROOF PLAN – AREA B AREA B AREA C AREA A DATE DESCRIPTION ",Plumbing
"SHEET NO. PROJECT NO.  PREPARED BY: REVISIONS SHEET CONTENT  CHECKED  BY: REVIEWED AND VERIFIED BY: PROJECT TITLE: LOCATION: APPROVED BY: Drawings and specifications and other contract documents duly signed, stamped or sealed, as instruments of service, are the intellectual property and documents of the architect, whether the object for which they are made is executed or not. It shall be unlawful for any person to duplicate or make copies of said documents for use in the repetition of and for other projects or buildings, whether executed partly or in whole, without the written consent of the architect or author of said documents. P-400 SCALE A3 A1 AS SHOWN 460 1040 1000 1300 1160 NOTE:  1. USE 6"" CHB WALL  2. 10mmØ VERTICAL BARS     SPACED @ 400mm O.C.  3. 10mmØ HORIZONTAL BARS  4. INSIDE WALL 12"" thick.     PLASTER FINISH 150 150 150 810 150 810 150 520 150 4050 FOR TOP & BOTTOM SLAB USE 10mmØ REBARS SPACED @ 200mm 0N CENTER BOTHWAYS 4"" INLET PIPE 500mm X 500mm MANHOLE 150 C.O. 300mm AIR SPACE DIGESTIVE CHAMBER LEACHING CHAMBER 300mm AIR SPACE 4"" INLET PIPE 2% SLOPE C.O. C.O. 50 530 UPFLOW FILTER 300mm AIR SPACE 460 2"" thick SLAB with 15mmØ WEEP HOLES @ 32mm O.C. B.W. 500mm X 500mm MANHOLE 500mm X 500mm MANHOLE 2% SLOPE MANHOLE MANHOLE MANHOLE water level CHOKER 3 4"" GRAVEL 4"" thick SLAB with 15mmØ WEEP HOLES @ 32mm O.C. B.W. N.G.L. N.G.L. 4"" OUTLET PIPE 100 810 120 690 A 120 300 2190 120 230 350 224 351 ODOR CATCH B N.G.L. 580 120 ODOR CATCH METAL GRATING 2"" thick SLAB with 15mmØ WEEP HOLES @ 32mm O.C. B.W. CHOKER 3 4"" GRAVEL METAL GRATING SECTION @ 'B' SECTION @ 'A' CHOKER 3 4"" GRAVEL PLAN MESH COPPER SCREEN 4"" SANITARY TEE 4"" OUTLET PIPE PRK. BUMANAAG, BRGY.ZONE III, KORONADAL CITY, SOUTH COTABATO, FO XII ENGR. FRANCIS C. ESTOMATA ENGR. CRESSYL ANN E. BANTAYA PDO III TECHNICAL FACILITATOR CEZARIO JOEL C. ESPEJO REGIONAL DIRECTOR DSWD - FIELD OFFICE XII RRCY, BRGY. BUKAY PAIT, TANTANGAN, SOUTH COTABATO ENGR. ROLLY A. TEOFILO PDO IV FOR INFRA CONSTRUCTION OF 2-UNITS ISOLATION BUIDLING (11-ROOMS) ",Plumbing
"SCALE: SCALE: SCALE: SCALE: SCALE: SCALE: SCALE: SCALE: DUPLEX SEWAGE PUMP SYSTEM SHALL INCLUDE: • PUMP CONTROL PANEL • FLOAT SWITCHES • PUMP REMOVAL SYSTEM • PUMP DISCHARGE PIPE ASSEMBLIES • FIBERGLASS BASIN • BASIN WITH STEEL COVER SHALL BE BOLTED TO THE TOP FLANGE OF THE BASIN PUMP • MOUNTING BASE SHALL BE BOLTED TO THE STEEL ANTI-FLOATING PLATE THAT IS EMBEDDED IN THE BOTTOM OF THE FIBERGLASS BASIN NOTE : OMIT ALUMINUM JACKET IF PIPING IS UNINSULATED. SEALANT FIRE RESISTANT SILICONE FOAM SEALER. FIRE STOP SHALL MEET THE REQUIREMENTS OF ASTM E 814 (UL1479). ESCUTCHEON PLATE ON ONE OR BOTH  SIDES WHERE PIPING IS EXPOSED. PIPE SLEEVE EXISTING POURED CONCRETE OR C.M.U WALL ANCHOR LUGS (MIN. 3 REQ'D) PIPE INSULATION (WHERE REQ'D) CUT OPENING IN EXISTING FIRE RATED WALL LARGER THAN SLEEVE AND FORM & FILL WITH EXPANSIVE TYPE GROUT. GROUT PIPE GALVANIZED STEEL SADDLE (INSULATION SHIELD) HIGH DENSITY PIPE INSULATION AT HANGER POINTS. REFER SPEC'S PIPE INSULATION HEAVY DUTY CLEVIS HANGER SUPPORT NUT JAMB NUT HANGER ROD CONCRETE SLAB CONCRETE ANCHOR STRAINER, FLUSH W/ FLOOR FLOOR (SEE ARCHITECTURAL PLAN FOR FLOOR SLOPES) ADJUSTABLE DRAIN HEAD ADJUSTABLE DRAIN HEAD INSIDE CAULK PIPE XX∅ PIPE FINISH FLOOR CLEANOUT ALTERNATE METHOD CLEANOUT PLUG FINISHED FLOOR FINISHED FLOOR HEAVY SCORIATED COVER SET LEVEL WITH FINISHED FLOOR ADJUSTABLE HOUSING SET SCREW 1/8 C.I. BEND 16""SQUARE CONC. PAD TROWEL SMOOTH AND EDGE. CLEANOUT FINISHED GRADE 18 GAUGE ROUND GALVANIZED STEEL CLEANOUT TEE CLEANOUT PIPE FINISHED WALL ACCESS COVER STRUCTURAL STEEL ANGLE HANGER ROD JAMB NUT SUPPORT NUT HEAVY DUTY CLEVIS HANGER PIPE INSULATION GALVANIZED STEEL SADDLE (INSULATION SHIELD) HIGH DENSITY PIPE INSULATION AT HANGER POINTS. REFER SPEC'S TO EQUIPMENT UNION PLUG VALVE SEDIMENT TRAP LOW PRESSURE GAS SUPPLY SEDIMENT TRAP UNION TO EQUIPMENT PLUG VALVE LOW PRESSURE GAS SUPPLY VERTICAL UP EQUIPMENT CONNECTION VERTICAL DOWN EQUIPMENT CONNECTION TO EQUIPMENT UNION PLUG VALVE SEDIMENT TRAP HORIZONTAL EQUIPMENT CONNECTION LOW PRESSURE GAS SUPPLY PLUG VALVE MEDIUM PRESSURE GAS MAIN TEE FITTING WITH OPENING CAPPED OR PLUGGED. FITTING TO ALLOW CONNECTION OF A PRESSURE MEASURING DEVICE AND TO SERVE AS A SEDIMENT TRAP. PRESSURE REGULATOR VALVE (PRV) TEE FITTING WITH OPENING CAPPED OR PLUGGED. INSTALLED NO LESS THAN 10 PIPE DIAMETERS DOWNSTREAM OF PRV POSITION. FITTING TO ALLOW CONNECTION OF A PRESSURE MEASURING DEVICE. PLUG VALVE UNION INCREASER AS REQUIRED TO EQUIPMENT TEE FITTING WITH OPENING CAPPED OR PLUGGED. INSTALLED NO LESS THAN 10 PIPE DIAMETERS DOWNSTREAM OF PRV POSITION. FITTING TO ALLOW CONNECTION OF A PRESSURE MEASURING DEVICE. PLUG VALVE UNION INCREASER AS REQUIRED TO EQUIPMENT PRESSURE REGULATOR VALVE (PRV) PLUG VALVE PRESSURE REGULATOR VALVE (PRV) TEE FITTING WITH OPENING CAPPED OR PLUGGED. INSTALLED NO LESS THAN 10 PIPE DIAMETERS DOWNSTREAM OF PRV POSITION. FITTING TO ALLOW CONNECTION OF A PRESSURE MEASURING DEVICE. PLUG VALVE UNION TO EQUIPMENT TEE FITTING WITH OPENING CAPPED OR PLUGGED. FITTING TO ALLOW CONNECTION OF A PRESSURE MEASURING DEVICE AND TO SERVE AS A SEDIMENT TRAP. PLUG VALVE MEDIUM PRESSURE GAS MAIN HORIZONTAL EQUIPMENT CONNECTION VERTICAL DOWN EQUIPMENT CONNECTION VERTICAL UP EQUIPMENT CONNECTION TEE FITTING WITH OPENING CAPPED OR PLUGGED. FITTING TO ALLOW CONNECTION OF A PRESSURE MEASURING DEVICE AND TO SERVE AS A SEDIMENT TRAP. LOW PRESSURE DETAIL MEDIUM TO LOW PRESSURE DETAIL INCREASER AS REQUIRED MEDIUM PRESSURE GAS MAIN TEMPERED WATER 100° F THERMOSTATIC MIXING VALVE ASSE 1070 1/2"" 120° F HW SUPPLY 1/2"" CW SUPPLY WASTE COUNTER FINISHED FLOOR SECURE JACKET WITH METAL BAND NO MORE THAN 1"" FROM END BACKUP MATERIAL MASONRY FLOOR SCHEDULE 40 STEEL OR CAST-IRON PIPE SLEEVE CUT FLUSH WITH FLOOR INSULATION (WHERE REQUIRED) METAL BAND NEAR FLOOR ALUMINUM JACKET WITH FACTORY APPLIED MOISTURE BARRIER. EXTEND FROM BELOW BACKUP MATERIAL TO 10"" ABOVE FLOOR (NOTE) GRADE ON SLAB PUMP OFF PUMP ON HIGH WATER ALARM PUMP ON FLOAT INLET 2"" VENT 12"" 6"" 6"" 18"" 6"" 4"" INLET HUB FIELD INSTALLED 4"" 48"" STEEL ANTI-FLOATING PLATE 2"" DISCHARGE PIPE PP-6 36"" 2"" VENT 2"" DISCHARGE 10"" INSPECTION PLATE WITH 8"" DIA. CLEAR ACCESS OPENING FLOOR DRAIN DETAIL NOT TO SCALE 3 P-7.1 PIPE PENETRATION THROUGH FLOOR NOT TO SCALE 6 P-7.1 PIPE PENETRATION THROUGH FIRE RATED WALL NOT TO SCALE 4 P-7.1 PIPE SUPPORT DETAIL NOT TO SCALE 2 P-7.1 CLEANOUT DETAIL NOT TO SCALE 5 P-7.1 SEWAGE EJECTOR DETAIL NOT TO SCALE 7 P-7.1 GAS EQUIPMENT CONNECTION DETAIL NOT TO SCALE 8 P-7.1 LOCAL MIXING VALVE DETAIL NOT TO SCALE 1 P-7.1 CLEANOUT NEAR BASE OF STACK WALL CLEANOUT GRADE CLEANOUT FLOOR CLEANOUT 1 2 3 4 5 6 7 8 9 10 11 12 13 14 15 16 17 18 11720 Beltsville Drive Suite 600 Calverton, MD 20705 Tel: 301.595.1000 1 2 3 4 5 6 7 8 9 10 11 12 13 14 15 16 17 18 A B C D E F G H J K L M A B C D E F G H J K L M © GRIMM AND PARKER, P.C. 2014 © GRIMM AND PARKER, P.C. 2014 www.grimmandparker.com HOLABIRD ACADEMY PK-8 CITY OF BALTIMORE, MARYLAND GP# 21553 M/E/P/FP DESIGN ENGINEERING • PROJECT MANAGEMENT ENERGY MANAGEMENT SERVICES • DESIGN-BUILD SERVICES CONSTRUCTION MANAGEMENT • COMMISSIONING DISTRICT OF COLUMBIA • MARYLAND NEW YORK • VIRGINIA www.SETTY.com PROJECT NUMBER: TM ONE SOUTH STREET, SUITE 1130 BALTIMORE, MARYLAND 21202 TEL: 667-309-6036 P-7.1 PLUMBING DETAILS 03/13/2017 BID SET SAXXYY###.## DATE DESCRIPTION ",Plumbing
"1 2 3 4 5 A B C D 6 7 A B C D 1 2 3 4 5 6 7 KITCHEN 120 BATH 121 BATH 122 KITCHEN 123 CLOSET 124 CLOSET 125 CLOSET 126 CLOSET 127 CLOSET 128 CLOSET 129 KITCHEN 130 KITCHEN 131 CLOSET 132 CLOSET 133 CLOSET 134 CLOSET 135 KITCHEN 136 BATH 137 BATH 138 KITCHEN 139 KITCHEN 140 BATH 141 BATH 142 KITCHEN 143 BATH 144 BATH 145 BEDROOM 162 BEDROOM 163 LIVING ROOM 164 LIVING ROOM 165 LIVING ROOM 166 LIVING ROOM 167 BEDROOM 168 BEDROOM 169 LIVING ROOM 170 BEDROOM 171 BEDROOM 172 LIVING ROOM 173 LIVING ROOM 174 BEDROOM 175 BEDROOM 176 LIVING ROOM 177 1 W 2 W 3 W 5 W 6 W 7 W 8 W 10 W 9 W 11 W 12 W BALANCING VALVE SET  TO 0.75 GPM (TYP) 1/2""  HWR 1-1/4"" HWR DN 1""  HWR 1""  HWR 1""  HWR 1""  HWR 1/2""  HWR 1/2""  HWR 1/2""  HWR 1/2""  HWR 1/2""  HWR 1/2""  HWR 1/2""  HWR HOT WATER RECIRCULATING PIPNG  IS IN THE 4TH FLOOR CEILING ONLY 4 W 1 G 3/4""CW UP TO  ROOF HYDRANT APPROVED BY DATE SPONSOR DATE MAINTENANCE ENG. OFF. DATE ENVIRONMENTAL MANAGEMENT DATE SAFETY DATE PROJECT LEADER DATE DRAWN BY DATE PROJECT/ W.O. # SH. NO. DWG. OF MEP. ENG. ARCHITECT DATE SHED - NIST FIRE MARSHAL/AHJ FACILITIES ENGR. OFF. DATE FOR OFFICIAL USE ONLY U.S. DEPARTMENT OF COMMERCE OFFICE OF FACILITIES & PROPERTY MANAGEMENT REVISION DESCRIPTION BY DATE VAY AA 08/15/2022 NIST - MID RISE APARTMENT P104 P104 PLUMBING FOURTH FLOOR PLAN - WATER & GAS Project Number 1/4"" = 1'-0"" 1 FOURTH FLOOR - WATER & GAS ",Plumbing
"1 2 3 4 5 A B C D 6 7 A B C D 1 2 3 4 5 6 7 KITCHEN 94 BATH 95 BATH 96 KITCHEN 97 CLOSET 98 CLOSET 99 CLOSET 100 CLOSET 101 CLOSET 102 CLOSET 103 KITCHEN 104 KITCHEN 105 CLOSET 106 CLOSET 107 CLOSET 108 CLOSET 109 KITCHEN 110 BATH 111 BATH 112 KITCHEN 113 KITCHEN 114 BATH 115 BATH 116 KITCHEN 117 BATH 118 BATH 119 BEDROOM 146 BEDROOM 147 LIVING ROOM 148 LIVING ROOM 149 LIVING ROOM 150 LIVING ROOM 151 BEDROOM 152 BEDROOM 153 LIVING ROOM 154 BEDROOM 155 BEDROOM 156 LIVING ROOM 157 LIVING ROOM 158 BEDROOM 159 BEDROOM 160 LIVING ROOM 161 1 W 2 W 4 W 3 W 5 W 6 W 7 W 8 W 10 W 9 W 11 W 12 W 1 G APPROVED BY DATE SPONSOR DATE MAINTENANCE ENG. OFF. DATE ENVIRONMENTAL MANAGEMENT DATE SAFETY DATE PROJECT LEADER DATE DRAWN BY DATE PROJECT/ W.O. # SH. NO. DWG. OF MEP. ENG. ARCHITECT DATE SHED - NIST FIRE MARSHAL/AHJ FACILITIES ENGR. OFF. DATE FOR OFFICIAL USE ONLY U.S. DEPARTMENT OF COMMERCE OFFICE OF FACILITIES & PROPERTY MANAGEMENT REVISION DESCRIPTION BY DATE VAY AA 08/15/2022 NIST - MID RISE APARTMENT P103 P103 PLUMBING THIRD FLOOR PLAN - WATER & GAS Project Number 1/4"" = 1'-0"" 1 THIRD FLOOR - WATER & GAS ",Plumbing
